AuthorID,Author,Date,Content,Attachments,Reactions
"863057716338229291","sun3691","6/9/2023 9:39 AM","1) Primeiramente na minha opinião tu não deves tentar agradar os outros, e se te falarem algo que fiques insegura não ligues para o que falem, porque quanto mais ligares para o que te disserem mais insegura vais ficar, então tenta ao máximo ignorar comentários ridiculos.  A pressão de agradares os outros pode resultar de sentimentos de isolamento e uma falta de interesses em eventos sociais.","",""
"863057716338229291","sun3691","6/9/2023 9:44 AM","2) Em segundo lugar, muitas pessoas gostam de ver os outros sofrer, porque assim vêm que não são os únicos indivíduos numa situação de estado mau e acabam por se sentir melhor por conta disso, mas também pode ser uma maneira de te recarregares emocionalmente.","",""
"863057716338229291","sun3691","6/9/2023 9:48 AM","3) Em terceiro lugar, eu acho muito bom enquanto estás nos teus estudos focares-te em ti, e deverias fazer isso em todo o lado e tentares ao máximo não agradar as outras pessoas, tens de colocar-te em primeiro lugar para te sentires confortável, não tentes te encaixar na sociedade.","",""
"863057716338229291","sun3691","6/9/2023 9:49 AM","Porque ao tentares encaixar-te no padrão da sociedade e veres que não consegues, vai fazer com que te sintas pior.","",""
"863057716338229291","sun3691","6/9/2023 9:49 AM","Tens de ser tu própria ao pé das outras pessoas, se elas não gostarem problema o delas","",""
"863057716338229291","sun3691","6/9/2023 9:59 AM","Por exemplo tem um cantor chamado Stromae ele parou de fazer shows e novas músicas e até mesmo ele disse em intervistas  que ele não pretende mais fazer músicas pelo simples facto que ele não conseguiu lidar com a fama, e tu tens de fazer o mesmo, para te sentires bem contigo mesma tens de agir como tu és e não tentares mudar a tua personalidade ao pé das pessoas.","",""
"863057716338229291","sun3691","6/9/2023 10:03 AM","4) N a minha opinião, tu não deves querer alguém ao teu lado, porque mesmo que queiras ou não maior parte das pessoas seguem a sua vida, por isso que eu acho que deves fazer o teu caminho sozinha, pq quando colocares na tua cabeça que não necessitas de ninguém para fazer o teu percurso na vida será mais fácil de lidares com as coisas e nao te vais sentir sozinha porque vais estar acompanhada por ti.","",""
"863057716338229291","sun3691","6/9/2023 10:07 AM","5) A automutilação pode ser um dos sinais de que estás q lidar com emoções intensas e tentas buscar alívio ou então o controle através da dor física.","",""
"863057716338229291","sun3691","6/9/2023 10:09 AM","A sensação de indiferença em relação à dor e a curiosidade em relação ao próprio sangue podem sugerir de uma desconexão emocional ou até mesmo da busca por sensações intensas. e isso tbm indica a presença de problemas emocionais ou de saúde mental","",""
"863057716338229291","sun3691","6/9/2023 10:11 AM","As tuas metas tens de explorar esses objetivos e refletires sobre se são verdadeiramente importantes para ti.","",""
"863057716338229291","sun3691","6/9/2023 10:12 AM","É recomendável procurares ajuda de um psicólogo ou terapeuta para lidar com esses sentimentos e comportamentos.","",""
"863057716338229291","sun3691","6/9/2023 10:12 AM","Isto é tudo a minha opinião, tu podes não aceitar a minha opiniao","",""
"1033439959165718628","guldfishy","6/9/2023 10:17 AM","Obrigada por ter dito isso, pior que eu estou insistindo muito em um psicólogo, mas não deu nada até agora.","","👍🏻 (1)"
"456226577798135808","Deleted User","6/10/2023 4:50 PM","Oie, tô precisando desabafar...
Minha relação com a minha mãe na vida real nunca foi boa...
Eu tô com muita crise de ansiedade e eu tô pensando em cometer suicídio...","",""
"803059481167790090","sweet._.frog","6/10/2023 5:08 PM","Por favor não faça isso!
O suicídio é um caminho sem volta, e acabar com sua vida nunca vai ser a melhor opção
As coisas podem estar difíceis, mas tudo passa, pode demorar um pouco, mas te garanto que as coisas iram melhorar!
Pense nas pessoas que te amam e te querem por perto, elas ficariam acabadas se te perdessem, não de tanta importância pra quem n gosta de vc, mas, preste atenção nas pessoas que te querem bem!
E sobre as crises de ansiedade eu sugiro vc procurar um psicologo, tentar descobrir se tem algum motivo em específico para vc ter essas crises para vc tentar controla-las","",""
"803059481167790090","sweet._.frog","6/10/2023 5:09 PM","Eu fico meio triste por n poder ajudar mais, até pq eu n sou mt boa com conselhos
Mas espero q entenda q sua vida tem valor!
E sempre que precisar estarei aq
Pode conversar cmg sempre q quiser!","",""
"949436198798123009","monkey.dluffy0754","6/10/2023 7:25 PM","tu ta loco","",""
"949436198798123009","monkey.dluffy0754","6/10/2023 7:25 PM","TU TA LOCO","",""
"949436198798123009","monkey.dluffy0754","6/10/2023 7:26 PM","cara é sério q tu vai se matar","",""
"949436198798123009","monkey.dluffy0754","6/10/2023 7:26 PM","mano","",""
"949436198798123009","monkey.dluffy0754","6/10/2023 7:26 PM","pensa comigo","",""
"949436198798123009","monkey.dluffy0754","6/10/2023 7:26 PM","mesmo q tenha várias crises q se foda","",""
"949436198798123009","monkey.dluffy0754","6/10/2023 7:26 PM","não deixa a depressão te vencer","",""
"949436198798123009","monkey.dluffy0754","6/10/2023 7:26 PM","você é forte!","",""
"949436198798123009","monkey.dluffy0754","6/10/2023 7:26 PM","tem tanta gente legal por ai","",""
"949436198798123009","monkey.dluffy0754","6/10/2023 7:27 PM","e você vai desperdiçar sua unica vida se matando","",""
"949436198798123009","monkey.dluffy0754","6/10/2023 7:27 PM","cara pensa no mundo","",""
"949436198798123009","monkey.dluffy0754","6/10/2023 7:27 PM","tem tantas coisa que você pode fazer","",""
"456226577798135808","Deleted User","6/10/2023 9:17 PM","Nossa cara, vc me disse palavras fortes agr","",""
"456226577798135808","Deleted User","6/10/2023 9:17 PM","Mto obrigado mano, agradeço","",""
"456226577798135808","Deleted User","6/10/2023 9:18 PM","Exatamente... vc tem razão","",""
"1053414346522361906","maisummaluco","6/12/2023 10:19 AM","Estão querendo me internar novamente hoje. Ontem a noite tive duas visões, numa me matava com uma corda, na outra matava minha esposa com uma faca. Estou com medo","",""
"1053414346522361906","maisummaluco","6/12/2023 10:19 AM","Não sei com quem falar","",""
"1053414346522361906","maisummaluco","6/12/2023 10:20 AM","Não sei com quem compartilhar","",""
"1053414346522361906","maisummaluco","6/12/2023 10:20 AM","Tenho pavor da ideia de estar internado novamente.","",""
"1053414346522361906","maisummaluco","6/12/2023 10:20 AM","Tenho medo de perder meu emprego por conta deste problema","",""
"1053414346522361906","maisummaluco","6/12/2023 10:20 AM","E se eu ficar internado como vai ser","",""
"1053414346522361906","maisummaluco","6/12/2023 10:20 AM","Estou entrando em uma crise neste exato momento","",""
"1053414346522361906","maisummaluco","6/12/2023 10:20 AM","Não consigo me manter parafo","",""
"1053414346522361906","maisummaluco","6/12/2023 10:21 AM","Falta ar para falar","",""
"1053414346522361906","maisummaluco","6/12/2023 10:21 AM","Medo me consome ao mesmo tempo que um monte de informação e dúvida chega em minha mente","",""
"1053414346522361906","maisummaluco","6/12/2023 10:21 AM","Não sei oq fazer","",""
"1053414346522361906","maisummaluco","6/12/2023 10:21 AM","Tenho medo de voltar pra casa e acontecer algo","",""
"1053414346522361906","maisummaluco","6/12/2023 10:21 AM","Tenho medo de ficar aqui e acabar não saindo mais","",""
"1053414346522361906","maisummaluco","6/12/2023 10:21 AM","Ou quando sair estar sem emprego novamente","",""
"1053414346522361906","maisummaluco","6/12/2023 10:22 AM","Foram 5 anos sem conseguir nada. Pra agora perder tudo por conta destes malditos problemas que me atormentam minha vida inteira","",""
"1053414346522361906","maisummaluco","6/12/2023 10:22 AM","Estou extremamente cansado de tudo, de todos.","",""
"1053414346522361906","maisummaluco","6/12/2023 10:22 AM","Sem vontade nenhuma de viver","",""
"1077617078510563451","memememel","6/12/2023 1:49 PM","Olá, vendo a situação por fora eu acredito que a internação nesse caso pode ser benéfica para você, sua última experiência foi ruim, mas há outros CAPS e outras clínicas que são capacitadas e tem empatia com seus pacientes.
Os problemas psiquiátricos estão sendo desconstruídos de preconceitos, por tanto, se a sua empresa te demitir apenas por você CUIDAR DA SUA SAÚDE você pode processa-los e ganhará o processo.
Você conviveu muitos anos com esses problemas e sua esposa está ciente disso, se ela te ama, irá te apoiar no tratamento!!
Você conquistou muitas coisas na vida e é capaz de conquistar uma melhora, mesmo que ela não seja linear e tenha recaídas, você vai conseguir.","",""
"743543216673914911","danviktor","6/12/2023 8:42 PM","Eu estou tendo umas dores de cabeça por conta da ansiedade, e ela não passa de jeito nenhum. Alguém sabe alguma forma de relaxar estou ficando maluco. Queria poder não sentir essas coisas ☹️","",""
"956681140595478538","es_thu","6/12/2023 9:27 PM","Você pode recorrer as atividades físicas, elas ajudam na vasculação cerebral","",""
"743543216673914911","danviktor","6/12/2023 9:41 PM","Pode ser, vou tentar amanhã de manhã correr um pouco. Vou tentar dormir agora e correr de manhã.","",""
"938457762365587476","dogi_dev","6/13/2023 1:08 PM","Eu não aguento mais","",""
"938457762365587476","dogi_dev","6/13/2023 1:09 PM","A todo momento estou chorando por dentro","",""
"938457762365587476","dogi_dev","6/13/2023 1:09 PM","É impossível não pensar em acabar com o inferno","",""
"938457762365587476","dogi_dev","6/13/2023 1:09 PM","A felicidade é uma ilusão","",""
"938457762365587476","dogi_dev","6/13/2023 1:10 PM","Eu tenho que segurar minhas lágrimas","",""
"938457762365587476","dogi_dev","6/13/2023 1:10 PM","Eu tenho que me segurar para não acabar com tudo","",""
"716390085896962058","Pokétwo#8236","6/13/2023 1:10 PM","","",""
"938457762365587476","dogi_dev","6/13/2023 1:11 PM","E no fim, tudo por causa de UMA coisa","",""
"938457762365587476","dogi_dev","6/13/2023 1:11 PM","A escola...","",""
"938457762365587476","dogi_dev","6/13/2023 1:11 PM","Todos me odriam","",""
"938457762365587476","dogi_dev","6/13/2023 1:11 PM","Todos me abandonaram","",""
"938457762365587476","dogi_dev","6/13/2023 1:11 PM","Tudo por esse esquema diabólico","",""
"938457762365587476","dogi_dev","6/13/2023 1:11 PM","Sinto vontade de matar a todos e me matar","",""
"938457762365587476","dogi_dev","6/13/2023 1:12 PM","Eu não sou mais eu mesmo","",""
"938457762365587476","dogi_dev","6/13/2023 1:12 PM","A ouvir essa palavra, eu pânico","",""
"938457762365587476","dogi_dev","6/13/2023 1:13 PM","Eu fico com ânsia de vômito e dificuldade de respirar","",""
"938457762365587476","dogi_dev","6/13/2023 1:13 PM","Eu faria de tudo para acabar com isso","",""
"938457762365587476","dogi_dev","6/13/2023 1:13 PM","","https://cdn.discordapp.com/attachments/1096597436178370620/1118211560565903550/Screenshot_20230605_175924_CapCut.jpg?ex=6518492b&is=6516f7ab&hm=6b160227ade36d26235c19b8a82e5240616c68640dc5f11ecd17f3095cb38f7a&",""
"938457762365587476","dogi_dev","6/13/2023 1:13 PM","Adeus","",""
"801186251117953035","skwfor","6/13/2023 1:38 PM","Talvez passageira sim, mas não uma ilusão quando ela for verdadeira com alguém ou algo.","",""
"801186251117953035","skwfor","6/13/2023 1:40 PM","Sei como é, eu também odeio esse lugar e infelizmente falta um tempinho para acabar. Mas, por que não ficar na sua e não ligar para os outros? Por que essa vontade de ser lembrado e não esquecido?","",""
"801186251117953035","skwfor","6/13/2023 1:44 PM","Sabe, as vezes não vale a pena cometer algo contra a sua vida sendo que as pessoas te julgam e etc. Se julgam ou te deixaram de canto, problemas delas, siga meu exemplo; eu vou an escola e não ligo para o que os outros falam, tenho raros amigos, porém, não confio neles, apenas faço a minha parte em silêncio e traço meus planos quieto, você deveria fazer ou pensar igual ou diferente sei lá...enfim, as vezes ficar sozinho e ser ""abandonado"" é a melhor coisa que temos.","",""
"254312604418179085","uaiii","6/13/2023 2:57 PM","qual esquema?","",""
"956681140595478538","es_thu","6/13/2023 6:47 PM","Oi eu queria vir aqui falar de alguns problemas.. eu ainda frequento a escola e é um ambiente que eu não aguento mais frequentar, só na quarta, quinta e sexta eu fico mais de 24 horas naquele lugar e ainda sinto que to sendo excluído entre as pessoas que eu fico e quando eu me reaproximo de outros que ja conversei eu sinto uma resistência, elém de ter que acompanhar o que cada professor fala sem se perder pq se n ja era e ter que levantar um sorriso falso pra cada pessoa que fala com vc tbm é desgastante e eu tenho pensamentos compulsivos que não tem ""basamento"" tão profundo pra sofrimento mas eles são intruzivos, eu não esqueço o assunto. A pressão que eu tenho pra manter minhas notas na média pelo medo de não conseguir recuperar eu simplesmente e eu não tenho como pedir ajuda para meus pais (sentido moral, psicológico) e eu to em desespero, eu to pedindo socorro, eu quero ajuda.. eu to no meu limite por favor alguém me ajuda!!! Vcs sabem de alguma plataforma, comunidade gratuita que possam me ajudar? já solicitamos um psicológico mas eu to aguardando os horários dele baterem com o meu mas eu quero voltar ao normal, eu quero rir genuinamente eu quero conseguir relaxar eu quero estar bem, eu quero falar pra mim que eu to bem e conseguir ajudar alguém que eu gosto e n afundar comigo..
É isso obrigado por lerem","",""
"752191242229776435","micael_yeager","6/14/2023 8:27 AM","Tá aí a motivação pra vc se esforçar e provar que mesmo sozinho consegue se sair melhor que os outros.","",""
"743543216673914911","danviktor","6/14/2023 9:45 AM","Talvez tenha que mudar o seu foco um pouco, pois parece que tudo é sobre como as pessoas te vêem. Pode ser que você esteja sobre um efeito holofote, você fica pensando muito sobre as suas imperfeições ou que as pessoas pensam sobre elas, mas na vdd você se preocupa mais sobre como eles vêem você, do que eles percebem o que é você( isso não te define). Talvez você faça ou pensa muito sobre expectativas dos outros, pq não fazer coisas que te agradam ? Em vez dos outros? Pq não falhar mais? Já pensamentos intrusivos eu tinha bastante eu na época me converti ao Budismo no zazen ensina muito sobre o que é o pensamento e como controlar esses pensamentos . É claro eu só estou dando meus conselhos sobre um texto que você escreveu, se você leu alguma parte que não te agradou ou que você não se identifica eu peço desculpas, só quero seu bem, quero dizer também ""que você não é aquilo que pensa, o passado não te define""😁","","❤️‍🩹 (1)"
"788833249630617651","shinobu_cyfra","6/15/2023 2:32 AM","Olá pessoal, bom eu sou novo aqui não conheço ninguém e etc, mas minha vida ultimamente está um caos e não tenho exatamente ninguém para conversar ou desabafar, minha família me julga e mais atrapalha do que ajuda, não tenho amigos sejam virtuais ou pessoalmente, tenho 18 anos e sofro de bipolaridade tipo 1 e ansiedade generalizada, aconteceram coisas ao longo da minha vida que me mudaram para sempre, sofri abusos físicos e mentais ainda quando criança e então sempre tive dificuldade em me relacionar com qualquer tipo de pessoa, eu sinto medo e dificilmente confio em alguém além de min mesmo, eu faço tratamento em média a 5 anos, mas desde o começo de 2023 eu me sinto péssimo, essa semana acabei perdendo a pessoa que eu mais amava e a única q eu confiava e podia conversar (graças a Deus essa pessoa está viva, porém não mais presente em minha vida) Eu agradeceria muito se alguém tentasse me ajudar, eu sinto uma solidão que nunca se preenche eu sinto que não me encaixo com nenhum padrão, eu não gosto do que a maioria das pessoas gostam, eu não penso como a maioria pensa, todos os dias eu penso em me matar, parece que a vida não tem um sentido, sei que nem sempre precisamos de um motivo para viver, mas eu procuro um motivo a anos, mas não tive resultados.. E nesse momento eu estou muito sensível, eu perdi a única pessoa que me alivia de toda essa guerra mental, eu não posso agora contar com ninguém além de min mesmo, eu sempre me esforço para dar o meu melhor e consigo, mas nunca é o suficiente, eu ajudo e escuto qualquer pessoa que precisar sem nem pensar duas vezes, mas já quando se trata de min ninguém tem interesse... Se alguém puder talvez conversar eu irei agradecer muito, pois sinto que meus dias estão contados.. Eu sinceramente estou sem forças e sinto que fui abandonado ou deixado aqui apenas para sofrer, as pessoas que eu tive a capacidade de amar infelizmente hoje em dia não estão mais ao meu lado.. Eu realmente preciso de ajuda pessoal de vdd....","",""
"788833249630617651","shinobu_cyfra","6/15/2023 2:42 AM","Eu não sinto frustração, mas eu sempre me esforcei para mostrar para todos que mesmo sozinho eu consigo me sair melhor que os outros, mas nunca é o suficiente, eu sempre sinto um vazio, uma solidão profunda, eu até questiono se tudo isso é real, não é justo isso eu sempre fiz o bem, eu ajudei diversas pessoas eu passei noites em claro ajudando quem mais precisava, e bom tudo que eu recebi foi o oposto, não que eu esperava receber algo em troca pois fiz na intenção de ajudar, mas não é justo que mesmo comigo fazendo o bem eu tenha que receber tanto sofrimento em troca, eu estou cansado, esse ano foi uma porcaria, tive que tomar atitudes que jamais pensei que teria que tomar, eu não sei mais o que fazer, eu realmente não quero ter que no fim acabar com a minha vida, mas as opções estão acabando, não recebo apoio de ninguém, não tenho ninguém perto, o meu esforço e dedicação não é o suficiente para me curar, eu não vejo sentido na vida mais, estou exausto e destruído... (Desculpem pelo desabafo gigante)","",""
"464888281889505280","cgvixx","6/15/2023 6:38 PM","Oi... olha, vou falar por experiência, ok?
Tenho 21 anos, apenas 3 anos depois dos meus 18. Quando tinha essa idade, eu jamais imaginaria que eu estaria na fase da vida em que estou hoje. Sempre fui muito infeliz desde pequena, nunca soube aproveitar as coisas boas e assim como você, depois de a única pessoa que me amava ter me deixado (só que ele faleceu, mesmo, era meu pai) comecei a passar por muitos abusos psicológicos pelos familiares que ""restaram"" e não tinha ninguém para estar comigo, nem família nem amigos, apenas sozinha. Nessa época, com 18 anos, também comecei a desacreditar da vida e não entender nem porque eu deveria estar aqui... até hoje em dia eu me sinto assim as vezes, como se não fizesse diferença a minha existência e fosse perda de tempo tentar viver, mas continuo pois hoje em dia tenho algumas felicidades simples e momentâneas, mas que me fazem querer ficar, sabe?  Preciso que você saiba que não tem problema nenhum você não gostar das mesmas coisas que os outros ou não pensar como os outros, *cada um é um*, todo mundo é diferente, isso que vc vê na internet é tudo as vezes forçado pra parecer q todo mundo tem a vida no lugar, as vezes é vdd, mas nem sempre é assim. Sei que é difícil mas pensa com muita seriedade que na verdade é muito bom ser você mesmo, ser a pessoa única que você é, com SEUS GOSTOS e SEUS PENSAMENTOS. Tem muitas pessoas como você e tenho certeza que com você continuando aqui para ver, você vai encontrar. E eu falo isso pq eu nunca achei que eu ainda estaria viva hoje, achei que nunca teria bons amigos e se vivesse, ia ser sozinha, mas muitas coisas mudaram só nesses 3 anos, entende? Dá um tempo pra si mesmo porque as coisas tendem sim a melhorar. Com 18 anos eu pensava que eu nunca ia ser feliz, nunca ia nem conseguir me sustentar ou viver sozinha e nunca teria nada de bom na minha vida. Acontece que no final dos meus 18 anos, por muitas oportunidades que me foram dadas e também decisões que tomei (como finalmente levantar e agir para criar meu futuro), consegui mudar algumas coisas e hoje apesar de ainda precisar de psicólogo e estar correndo atrás de medicamentos (pq tenho desequilíbrio emocional por conta de todas as merdas q passei na vida), tenho esperança as vezes (outras vezes quero e até tento me matar, mas essa esperança me mantém aqui, sabe?). No meu caso, eu tive uma grande motivação pra mudar essa situação, que foi conhecer meu namorado e querer ficar com ele e construir as coisas, mas ninguém precisa disso pra querer viver, você é completamente capaz de viver sozinho, mesmo com a dor de ter sido abandonado por essa pessoa aí q vc disse. Só quero dizer que as coisas podem mudar, se você agir pra isso também. Se forçar um pouquinho POR SI MESMO, e para quem realmente vai te valorizar, porque não vale a pena disponibilizar tanto do seu tempo e da sua bondade para ajudar pessoas que não se preocupam com você. Não tô dizendo pra vc parar de ser uma pessoa boa e abandonar os outros também, mas se dói em você essa falta de consideração, procura talvez se afastar disso.","","👋 (1),⛹️‍♂️ (1),❤️‍🩹 (2)"
"464888281889505280","cgvixx","6/15/2023 6:38 PM","Você disse ""as pessoas que eu tive a capacidade de amar infelizmente hoje em dia não estão mais ao meu lado.."". Vem cá, você é capaz de conhecer e amar muito mais pessoas, se você assim desejar. As relações humanas se iniciam e desenvolvem quando a gente menos espera, mas temos que nos abrir para isso também. Se você conseguiu amar essas pessoas, EU TENHO CERTEZA que vai conseguir amar ainda mais outras. E também será amado. Confia em mim. Com 18 eu já tinha aceitado q ninguém nunca me amaria e eu nem queria isso mesmo, mas ora ora, consegui! Se você deseja isso, ou sei lá, saiba q vai haver esse momento, ok? E se já houve mas você perdeu tal/tais pessoas, mais certeza ainda de que haverão outros, pois vc consegue ser amado, a prova é isso.

Você ainda mora com seus pais? Eu também morava com minha mãe e o inferno que era eu nem consigo descrever pra você, assim como sua família, a minha só atrapalhava e me culpava por tudo, eu era uma bosta pra todos eles, então o que eu fiz? Me esforcei pra vazar dali

E foi a primeira coisa que mudou pra melhor, pois eu já não tinha que sentir todo aquele peso que colocavam em mim. Se você puder, encontre seu jeito de fazer isso também. Infelizmente vai ter que ser você a agir, pois nada vai mudar sozinho. No meu caso, eu ralei e estudei muito pra passar num concursinho da cidade do meu namorado, e consegui. Dei o primeiro passo pra sair do inferninho que me deixava cada dia com mais vontade de morrer.

E é assim. Pega todas as coisas/situações/motivos que estão te deixando com essa vontade e desesperança e elimina cada um aos poucos, não é fácil, precisa de paciência e esforço e sempre haverão mais outros problemas, mas faz isso.

Outra coisa, eu falo da idade 18 anos toda hora não pq vc é novo ou algo assim, mas sim porque espero te dar esperança de que em meros 2 ou 3 anos, coisas podem mudar se você se prestar a aguentar mais um pouquinho cada dia.","","❤️‍🩹 (2)"
"464888281889505280","cgvixx","6/15/2023 6:43 PM","@~Shinobu~ E sobre o fato de você sempre se esforçar para ser o melhor e ajudar os outros mas ser injustiçado pois ninguém tem essa bondade com você... Eu também sinto isso, sabe? Sempre sinto que me esforço demais e mesmo assim cada dia só tenho mais dificuldades pra lidar... Sei que a gente pensa que é injusto a gente tentar ser tão bom e só ganhar coisa ruim (ou não ganhar nada mesmo) da vida e dos outros, mas o que me ""conforta"" é que essas coisas me fortalecem e me fazem uma pessoa melhor e que sabe lidar, sabe?","",""
"464888281889505280","cgvixx","6/15/2023 6:43 PM","Não sei se esse pensamento vai te ajudar, mas eu me conformei com isso e fico feliz de pelo menos eu ser quem eu queria que os outros fossem pra mim","",""
"464888281889505280","cgvixx","6/15/2023 6:43 PM","e que é suficiente eu me reconhecer, se ninguém mais faz isso","",""
"464888281889505280","cgvixx","6/15/2023 6:44 PM","Mas isso é na minha vida, também. Talvez seja diferente com você e um dia alguém vá te reconhecer e dar de volta tudo o que você dá de si. Mas se não, não espere por isso, também. Você não precisa","",""
"464888281889505280","cgvixx","6/15/2023 6:44 PM","@~Shinobu~ se vc puder falar mais sobre como se sente ou qualquer coisa q queira ajuda, tô aqui. No privado tb","",""
"464888281889505280","cgvixx","6/15/2023 6:45 PM","vem cá, o que aconteceu?","",""
"464888281889505280","cgvixx","6/15/2023 6:47 PM","se quiser, conta um pouco mais do que faz com que a escola seja tão ruim pra vc","",""
"788833249630617651","shinobu_cyfra","6/15/2023 7:10 PM","Eu n tenho palavras para descrever o quão importante foi para min ler suas palavras, muito obrigado, obrigado, as vezes nós não precisamos de uma solução, as vezes só precisamos ser ouvidos e entendidos, infelizmente eu não recebo nenhum tipo de atenção conselho ou afeto desde criança, isso acabou me isolando, mas muito obrigado por cada palavra tá? Se vc precisar de qualquer dia conversar estarei a ouvidos também obrigado!","",""
