AuthorID,Author,Date,Content,Attachments,Reactions
"906388292566646794","darkktrickster","6/15/2022 1:29 AM","Boa noite, mals pela hora, puta insônia!
To passando pelo pior momento da vida, faz um mês que perdi minha mãe e hj ta foda, ai achei esse discord de desabafo
3 anos lutando contra uma doença que não tinha cura ELA( Esclerose lateral amiotrófica), no primeiro ano ela parou de falar, logo parou de andar, ai veio a dificuldade pra respirar e logo ela se foi, muito sofrimento nesses 3 anos
solidão inexplicável, vazio que não tem como preencher
sinto que n tenho mais ngm e n tenho pq continuar
altas madrugadas sem conseguir dormir
pra todo mundo eu to lidando muito bem
mas na vdd me sinto tão sozinho, todo mundo passou e n ficou até a pessoa mais importante do mundo passou e sumiu
amizade então nenhuma, só vivo lembrando das pessoas que passaram e foram embora, deis do meu irmão que se matou quando eu tinha 13 até minha mãe que faleceu por causa da maldita doença
foi de ""amigos"" que eram quase família  que eu recebi as maiores facadas, quando a gente tava lutando contra a doença dela, nos momentos mais difíceis foram todos embora
mas é uma dor que não passa e muitas magoas","",""
"906388292566646794","darkktrickster","6/15/2022 1:30 AM","coloquei no de cima mals","",""
"906388292566646794","darkktrickster","6/15/2022 1:30 AM","ai mudei pra esse","",""
"906388292566646794","darkktrickster","6/15/2022 1:37 AM","bom, nunca vai passar e eu sequer tenho alguém pra desabafar, tenho que vir num grupo aleatório, pq n existe ngm que se importa o suficiente  e o pior de tudo é que amanha 5:30 eu tenho que estar de pé de novo, fingindo que tá tudo bem","",""
"906388292566646794","darkktrickster","6/15/2022 1:38 AM","mals ai o desabafo, mas dói demais continuar","",""
"906388292566646794","darkktrickster","6/15/2022 1:39 AM","medo da crise voltar","",""
"906388292566646794","darkktrickster","6/15/2022 1:41 AM","com tudo que ta acontecendo, eu n sei como eu ainda continuo aqui","",""
"668519558943997982","logoff12","6/15/2022 3:00 AM","Cara, dizer a real, não faço ideia do que você tá sentindo. Mas sei como é complicado esse sentimento de pensar que não existe ninguém no mundo para te ajudar a levantar o peso, ninguém pra desabafar, é complicado, mas acredite, você tem sim alguém ou, nesse caso, algo.
Sempre vai ter alguém para escutar suas palavras, seja aqui ou em outro lugar, seja eu ou outra pessoa, as vezes você só precisa olhar para outro lugar para descobrir essa pessoa ou pessoas dispostas a te ouvir.","",""
"668519558943997982","logoff12","6/15/2022 3:04 AM","Alias, seja bem vindo pra conversar sempre que quiser, e não desista, ainda tem muito que vale a pena no mundo, muito mesmo.","",""
"906388292566646794","darkktrickster","6/15/2022 9:45 AM","Sei lá, hj em dia é bem complicado de até procurar esse alguém, por causa de alguns traumas, mas ainda bem que encontrei esse servidor","",""
"906388292566646794","darkktrickster","6/15/2022 9:45 AM","Obrigado","",""
"668519558943997982","logoff12","6/15/2022 9:47 AM","Não se preocupe, você sempre pode desabafar aqui se não tiver alguém com você","",""
"752191242229776435","micael_yeager","6/15/2022 6:38 PM","@Deleted User","",""
"752191242229776435","micael_yeager","6/15/2022 6:38 PM","Oi","",""
"752191242229776435","micael_yeager","6/15/2022 6:39 PM","Padrão , descreve seu dia a dia e depois as coisas que tão te deixando pra baixo , Jajá venho aqui conversar","",""
"456226577798135808","Deleted User","6/15/2022 6:51 PM","acordo, faço as coisas básicas (tomar café, arrumar a cama e etc...), vejo uns bgl sobre a minha religião, leio a bíblia, saio pra correr(não sempre, queria conseguir correr todos os dias), chego, exercício físico (tbm não é sempre), banho, estudo mat com pdf, leio hq em inglês e dps livro... anki e várias outras coisas, quando vejo já são 18/19 horas da noite... meus maiores problemas é quando vejo porn entre a tarde e fico sem motivação pra nada dps... me sinto um lixo, mas as vezes vem a mente coisas motivacionais, de não desistir e tentar dnv, pq ficar deitado nn vai mudar nada e etc (quero me trazer a memória aquilo que me dá esperança)... e tbm a noite, eu me sinto solitário, muitas vezes acabo criando cenários que nunca vão acontecer na minha mente e dps vejo que a vida real é totalmente diferente, e isso me dá mt ansiedade...","",""
"752191242229776435","micael_yeager","6/15/2022 6:53 PM","Vc sai com amigos ?","",""
"752191242229776435","micael_yeager","6/15/2022 7:10 PM","Vc falo memória , oque te da esperança ?","",""
"456226577798135808","Deleted User","6/16/2022 12:57 AM","bom, quando saio pra correr, eu saio com um amigo meu","",""
"456226577798135808","Deleted User","6/16/2022 12:59 AM","minha mãe e em tentar ser uma pessoa melhor...","",""
"456226577798135808","Deleted User","6/16/2022 12:59 AM","Deus","",""
"456226577798135808","Deleted User","6/16/2022 1:00 AM","no dia de amanhã, onde pode ser um dia melhor...","",""
"971240504631132260","leo_cass","6/16/2022 1:36 PM","Atualmente, odeio feriados. Tô péssimo.","",""
"354012338938183685","jury_rigg","6/16/2022 2:05 PM","Eu me identifico com essa última parte","",""
"906388292566646794","darkktrickster","6/16/2022 3:40 PM","também odeio puta vazio nesses dias, tento o máximo me distrair","",""
"254312604418179085","uaiii","6/19/2022 12:03 AM","Tô começando a sentir um certo afastamento social mais forte, percebi na pele q as pessoas podem ser escrotas  demais. Só da pra confiar em nós mesmos, me sinto cansada e insuficiente! Sinto q devo me abster de tudo.","",""
"752191242229776435","micael_yeager","6/19/2022 12:15 AM","Oque aconteceu miga ?","",""
"254312604418179085","uaiii","6/19/2022 12:16 AM","Tenho ficado pensativa sobre coisas q li esses dias, em como as pessoas são ruins. Nem da pra acreditar","",""
"752191242229776435","micael_yeager","6/19/2022 12:17 AM","Oque se andou lendo ? Compartilha com seu migo","",""
"254312604418179085","uaiii","6/19/2022 12:17 AM","Nem posso falar mais, já passou!  Só q é nojento demais, desejar coisas ruins pros outros!","",""
"254312604418179085","uaiii","6/19/2022 12:17 AM","Meu deus","",""
"254312604418179085","uaiii","6/19/2022 12:18 AM","Tô começando a ficar com medo das pessoas","",""
"716390085896962058","Pokétwo#8236","6/19/2022 12:18 AM","","",""
"752191242229776435","micael_yeager","6/19/2022 12:19 AM","Vc leu em algum lugar ou algum amigo seu escreveu pra vc ?","",""
"752191242229776435","micael_yeager","6/19/2022 12:19 AM","Humanos ,_, 
Clueldade tá no sangue 😂","",""
"254312604418179085","uaiii","6/19/2022 12:21 AM","Ah, li por ai","",""
"752191242229776435","micael_yeager","6/19/2022 12:21 AM","Tendi","",""
"752191242229776435","micael_yeager","6/19/2022 12:21 AM","Vc tem algum amigo que vc tem medo ?","",""
"254312604418179085","uaiii","6/19/2022 12:22 AM","Não, não tenho","",""
"752191242229776435","micael_yeager","6/19/2022 12:22 AM","Isso é bom ksk","",""
"254312604418179085","uaiii","6/19/2022 12:22 AM","Eu geralmente não tenho medo de nada","",""
"254312604418179085","uaiii","6/19/2022 12:22 AM","Mas enfim","",""
"752191242229776435","micael_yeager","6/19/2022 12:22 AM","Eu e vc o oposto um do outro","",""
"254312604418179085","uaiii","6/19/2022 12:23 AM","Difícil lidar com certas situações kkkk","",""
"752191242229776435","micael_yeager","6/19/2022 12:23 AM","Algumas sim","",""
"254312604418179085","uaiii","6/19/2022 12:23 AM","Só tenho medo do escuro kkkkk","",""
"752191242229776435","micael_yeager","6/19/2022 12:23 AM","Eu me assusto muito fácil sabe","",""
"752191242229776435","micael_yeager","6/19/2022 12:24 AM","Qualquer coisa e eu....AAAAAAH","",""
"254312604418179085","uaiii","6/19/2022 12:24 AM","Kakaka","",""
"752191242229776435","micael_yeager","6/19/2022 12:24 AM","Tá no sangue da família TwT","",""
"254312604418179085","uaiii","6/19/2022 12:24 AM","Se eu me assusto eu fico é brava kkk","",""
"752191242229776435","micael_yeager","6/19/2022 12:25 AM","Eu quase sofro infarte","",""
"254312604418179085","uaiii","6/19/2022 12:25 AM","Kakaka","",""
"254312604418179085","uaiii","6/19/2022 12:25 AM","Cuidado ent hein","",""
"752191242229776435","micael_yeager","6/19/2022 12:26 AM","Eu tento ksk","",""
"752191242229776435","micael_yeager","6/19/2022 12:29 AM","Não se isola não , isso não faz bem","",""
"254312604418179085","uaiii","6/19/2022 12:30 AM","Eu sempre fui um pouco","",""
"752191242229776435","micael_yeager","6/19/2022 12:31 AM","Se solta mais então","",""
"752191242229776435","micael_yeager","6/19/2022 12:31 AM","Sla sai com seu namorado e seus amigos tudo junto reúne galera tlgd","",""
"254312604418179085","uaiii","6/19/2022 12:33 AM","Meu namorado é uma das minhas únicas companhias, mas eu tbm não sou dependente emocional dele.","",""
"254312604418179085","uaiii","6/19/2022 12:33 AM","Queria amigos, mas pessoalmente é muito difícil de trabalhar isso","",""
"752191242229776435","micael_yeager","6/19/2022 12:33 AM","Ele te trata bem ?","",""
"254312604418179085","uaiii","6/19/2022 12:33 AM","Melhor até doq eu mereço","",""
"752191242229776435","micael_yeager","6/19/2022 12:34 AM","É muito complicado ;-; eu nunca saio de casa tipo....0 amigos ksks","",""
"752191242229776435","micael_yeager","6/19/2022 12:34 AM","Qbom que ele cuida de vc ksk","",""
"752191242229776435","micael_yeager","6/19/2022 12:34 AM","Da valor nele , retribui esse carinho","",""
"254312604418179085","uaiii","6/19/2022 12:35 AM","Eu retribuo, eu tento! Nunca fui 100% carinhosa","",""
"254312604418179085","uaiii","6/19/2022 12:35 AM","Mas eu amo","",""
"752191242229776435","micael_yeager","6/19/2022 12:38 AM","Fala aí vai kkk","",""
"752191242229776435","micael_yeager","6/19/2022 12:38 AM","Não custa","",""
"254312604418179085","uaiii","6/19/2022 12:41 AM","Custa sim","",""
"254312604418179085","uaiii","6/19/2022 12:41 AM","Uns 20 mil","",""
"254312604418179085","uaiii","6/19/2022 12:41 AM",":emoji_22:","",""
"753227758532034671","mibyon","6/19/2022 11:37 PM","um caso antigo que eu gostaria de tirar do bau é que uma amiga da minha infância me machucava fisicamente é psicologicamente so por diversao
e toda vez que eu tentei cortar amizade com ela, ela me ameaçava
mas eu consegui graças a pandemia
ficar longe dela
por isso eu tenho trauma de amizade
a maioria foi toxica
e eu sempre saio de a errada da historia","","🙏 (1)"
"523131901293232128","kv_fada","6/21/2022 1:36 AM","Bom, dá para ter uma noção do motivo de você ter esse trauma. Pelo visto seu problema são amizades pessoalmente, o que realmente complica já que as pessoas acabam sendo bem menos legais, mas você ainda pode conseguir criar laços verdadeiros de amizade, suponho que já tenha tentado com todos da sala de aula (se estuda em colégio público), mas mesmo assim, se esse for o caso, sempre podemos encontrar alguém novo num lugar quase todo explorado, que no final só queira bons amigos que nem nós","",""
"523131901293232128","kv_fada","6/21/2022 1:37 AM","Bom, sem dúvidas você vai conseguir achar alguém daora e superar esse trauma","",""
"523131901293232128","kv_fada","6/21/2022 1:38 AM","Lembre-se que se existe você, uma pessoa legal que realmente consegue se importar com as amizades, por que não existiria mais iguais a você que são gente boa?","",""
"753227758532034671","mibyon","6/21/2022 9:41 PM","bom ate agora tudo vira um ciclo, talvez ate eu ficar sem amigos dnv","",""
"753227758532034671","mibyon","6/21/2022 9:41 PM","é esperar que mais alguns anos passem é eu volte a ter amigos assim como aconteceu antes","",""
"906388292566646794","darkktrickster","6/22/2022 11:44 PM","Boa noite, ultimamente ando querendo acabar com minha vida, perdi todo mundo cuidei por 3 anos junto com a minha vó, pq ela tinha   e ela faleceu recentemente, quando era adolescente meu irmão se matou, na minha vida nunca tive pessoas que se importassem, as que se importavam se foram, n tenho ngm, minha vida não importa mais, n consigo mais lutar","",""
"752191242229776435","micael_yeager","6/23/2022 9:53 AM","Então viva e orgulhe sua avó , pois lande cima ela te observa , se torne o neto que ela teria orgulho.....tenha uma vida feliz.... As coisas tão ruim agora mas desisti não nem tudo tá perdido sabe vc tá aqui vivo agora","",""
"456226577798135808","Deleted User","6/25/2022 1:14 PM","Bom dia, hoje eu gostaria de desabafar, sobre uma experiência traumática da minha vida.  Quando eu tinha uns 21 anos, eu tinha um cabelo muito bem cuidado, até o ombro,  não me sentia bem deixando meus cabelos pra qualquer barbeiro cuidar. Então eu frequentava salões de boa estética e rezava para que eles fossem bons. Um amigo meu, Lucas, me procurou, disse que queria mudar a estética corporal com depilação. Queria se tornar um cara mais sexy e desejado. Ele sempre me dizia que achava bonito, pelos no peito. Então eu fiz a indicação de um salão, o que eu cortava meus cabelos. Ele por se muito envergonhado me pediu pra ir junto, mas com uma condição: Que eu também fizesse a depilação antes dele. Pois ele era medroso é nem sabia como funcionava. Eu como bom amigo, fui ao salão e agendei um horário. No dia combinado, passei na casa desse meu amigo pra gente ir caminhando pro salão. Chegando lá, só havia mulheres. O salão foi esvaziando é praticamente ficaram três pessoas. O depilador, Lucas e eu. Devido a minha tatuagem na perna, eu estava acostumado a depilar as pernas pra ficar uma tatoo mais visível e pelos no resto do corpo são em pouca quantidade.  Então o depilador só precisou depilar minhas pernas. Logo em seguida, o Lucas tirou as calças, ficou de cueca ,subiu na mesa de depilação. Ele era estilo tony ramos, só que não tinha pelos saindo pelas orelhas.","",""
"456226577798135808","Deleted User","6/25/2022 1:14 PM","Quando o depilador puxou a cêra, ele deu um grito e quis sair da mesa. Então eu insisti para que ele ficasse. Então ele prosseguiu com a depilação. Depilou as pernas com muito custo, depois, depilou as costas. E na cabeça dele, havia ficado sexy iguais aos caras dos filmes de Hollywood. Mas então, o depilador levantou um questionamento que nos deixou pensativos. Ele perguntou: Lucas, não entendi a sua, depilou as pernas, estão lindas, as costas também, e vai deixar a bunda toda cabeluda? Eu quase caí pra trás, quando percebi que era verdade. Então o Lucas disse: Pode depilar ! Então o depilador teve que utilizar suas artimanhas para transformar uma cueca boxer, numa cueca fio dental, pra depilar aquela bunda toda cabeluda. No final das contas, acho que ele conseguiu o que queria, depilou as costas, as pernas e a bunda o depilador nem cobrou, foi uma cortesia! Por ironia do destino, o salão se chama nova aparência. Hoje, lucas e eu não somos mais amigos, mas todos nós sabemos o que aconteceu naquele verão 😆","","😆 (2)"
"254312604418179085","uaiii","6/25/2022 1:38 PM","Eu tô rindo kkkkk","",""
"936771772857090118","pneumeow2014","6/25/2022 2:34 PM","Oq tem eu ai kkk","",""
"752191242229776435","micael_yeager","6/25/2022 5:43 PM","Me desculpem mas.....eu não consigo parar de rir kkkkk o final vey","",""
"801186251117953035","skwfor","6/29/2022 7:58 PM","Tenho medo de que alguém comece a gostar de mim e no final não saiba como resolver.","",""
"801186251117953035","skwfor","6/29/2022 8:04 PM","Uma amizade entre dois sexos diferentes. O sexo femenino parece bem...bem a vontade, para não dizer mais palavras.","",""
"752191242229776435","micael_yeager","6/29/2022 8:17 PM","E pq alguém gostar de vc seria algo ruim ?","",""
"752191242229776435","micael_yeager","6/29/2022 8:22 PM","Aí surge o....vc é legal mas não faz meu tipo ,_,","",""
"801186251117953035","skwfor","6/29/2022 9:01 PM","É por aí.","",""
"817367171843358750","Vieira#1496","6/29/2022 9:03 PM","Caralho man","",""
"752191242229776435","micael_yeager","6/29/2022 9:07 PM","Já que vc cito o feminino....eu entendi daí "" se uma garota gostar muito de mim mas eu não gostar dela , não sei como não magoar os sentimentos dela "" eu viajei muito ou acertei ?","",""
"801186251117953035","skwfor","6/29/2022 9:19 PM","Acertou, não sei como não magoar ela, complicado isso.","",""
"752191242229776435","micael_yeager","6/29/2022 10:00 PM","Mas alguém tá gostando de vc ou é ipoteticamente","",""
"752191242229776435","micael_yeager","6/29/2022 10:20 PM","Reuno aqui 

A filosofia @Vieira 
A inteligência @Deleted User  

Uma curiosidade , quando tu é incapaz de magoar garotas , como dizer eu não te amo sem machucar ? ,_,  ( pq eu tbm sou incapaz ksk )","",""
"456226577798135808","Deleted User","6/29/2022 10:26 PM","Assista a um filme chamado o primeiro mentiroso. Comédia boba, mas inteligente. Vai te mostrar que o caminho mais correto é a honestidade. Seja honesto com a menina. As pessoas vão se magoar com você independente do que você faça. Então seja honesto com ela e consigo mesmo. Você não está interessado e pronto. Nada nem ninguém pode te obrigar a fazer algo que você não queira. Você pode dizer tudo, mas pra tudo existe uma melhor maneira de se dizer.","",""
"456226577798135808","Deleted User","6/29/2022 10:27 PM","Se as pessoas fossem sinceras umas com as outras, seria tão mais fácil. E as vezes a gente não perderia noites em dúvida se a pessoa está ou não interessada em nós. E as vezes as pessoas pra não magoar nossos sentimentos, nos acabam iludindo pra lá na frente nós machucar. Se tiver que machucar, se tiver que sofrer, que seja no começo. É tudo questão de tempo.","",""
"456226577798135808","Deleted User","6/29/2022 10:29 PM","Você dizendo que não quer nada, está simplificando e facilitando as coisas para que ela não crie esperanças contigo. Não gaste o tempo dela e energia dela investindo numa pessoa que as vezes não a vê da mesma maneira","",""
"752191242229776435","micael_yeager","6/29/2022 10:29 PM",",_,","",""
"456226577798135808","Deleted User","6/29/2022 10:34 PM","Se a gente pensar sempre no sofrimento do outro, nossa vida não vai pra frente e nem a vida do outro. O sofrimento também ensina a viver. Aquele que não sofre, não vive pois é a através do sofrimento que ganhamos experiência","",""
"456226577798135808","Deleted User","6/29/2022 10:35 PM","Então a gente não vai se envolver com ninguém, ser amigo de ninguém pois isso corre risco da pessoa se apaixonar ou você se apaixonar pela pessoa.","",""
"456226577798135808","Deleted User","6/29/2022 10:35 PM","💘","",""
"456226577798135808","Deleted User","6/29/2022 10:37 PM","Imagina vocês deixarem de conhecer pessoas, se envolver pra não as magoar.","",""
"817367171843358750","Vieira#1496","6/30/2022 3:40 AM","Ah man, negócio é não se sacrificar totalmente. Entender os lugares que cada um estão, tipo, o namoro por si só é como uma junção de duas carnes em uma. Tem uma teoria, que era chamada de amor magnética, acho que alguém tinha removido meu comentário (e fez o certo, de certa forma).

Enfim, dentro do amor você vai encontrar sacríficios com relativa frequência, geralmente quando tu namora vai encontrar opurtunidades meio sujas, mas entrando de corpo e alma para manter a união é pra mim sendo sincero algo completo.","",""
"817367171843358750","Vieira#1496","6/30/2022 3:48 AM","E sobre não magoar garotas meu caro champions.

Tenta mandar a real de forma respeitosa, ""obrigado pela proposta, isso significa muito para mim vindo de ti, mas não posso, eu namoro e a(o) amo muito. Quem sabe no fúturo algo esteja preparado?""","",""
"801186251117953035","skwfor","6/30/2022 12:35 PM","Pode ser que daqui um tempo cemece a gostar...","",""
"801186251117953035","skwfor","6/30/2022 12:35 PM","Se quiser, a noite te falo melhor no pv, o dia tá corrido hoje.","",""
"752191242229776435","micael_yeager","6/30/2022 12:35 PM","Tá bom","",""
"752191242229776435","micael_yeager","6/30/2022 12:35 PM","Mas lê aí oque o danger ei viera falo @Skwfor","","👍 (1)"
"817367171843358750","Vieira#1496","6/30/2022 2:30 PM","Também é interessante falar que mesmo nas dúvidas, as vezes é bom arriscar. O amor se desenvolve de dentro, do auto amor. Talvez ela te complete e tu complete ela","",""
"752191242229776435","micael_yeager","6/30/2022 4:41 PM","As vezes acontece isso ksk só uma das duas pessoas gosta da outra desse jeito , mas daí ficam juntas e com o tempinho a outra começa a gostar de ter a outra perto....","",""
"842078793753427970","skiptags","6/30/2022 11:06 PM","na minha vida tem dado certo tudo, tudinho mesmo, resumidamente tenho muitos problemas psicológicos que tienda minha vida bastante complicada, eu já estive nesse servidor mas resolvi voltar porque não quero ficar sem ninguém pra conversar","",""
"456226577798135808","Deleted User","6/30/2022 11:43 PM","Oi, boa noite. Seja bem-vindo novamente. Vi que em alguns aspectos sua vida é muito boa. Isso pra alguns de nós é de difícil reconhecimento pois quando o psicológico não anda bem, vai tudo errado mas nós temos que saber diferenciar pra poder fazer um balanço e investir energia no que não vai bem. Que no seu caso são os problemas psicológicos. Vi que você tem asperger. Não sei por qual motivo você saiu do servidor mas se isolar no seu caso acho que não dá benefícios a você. Sei que pra gente ser feliz, nossa felicidade não pode estar condicionada a nada e nem a ninguém. Mas se te faz bem ficar aqui, vai curtindo.","",""
"456226577798135808","Deleted User","6/30/2022 11:45 PM","Aqui sempre você terá alguns colegas pra te dar alguns conselhos e te fazer rir. Eu mesmo sempre estou por aqui, você precisando, só dizer.","",""
"842078793753427970","skiptags","6/30/2022 11:48 PM","muito difícil né fazer rir","",""
"456226577798135808","Deleted User","6/30/2022 11:50 PM","Você ainda não viu os papos deles, cada coisa mais cabeluda que a outra.’sempre que converso com algum programador me lembro de neo da matrix","",""
"842078793753427970","skiptags","6/30/2022 11:52 PM","como você sabe que sou programador?","",""
"456226577798135808","Deleted User","6/30/2022 11:52 PM","Sou eu, morpheus!","",""
"456226577798135808","Deleted User","6/30/2022 11:53 PM","Não precisa se esconder, neo. Siga o coelho até a toca😆","",""
"842078793753427970","skiptags","6/30/2022 11:54 PM","não entendi","",""
"456226577798135808","Deleted User","6/30/2022 11:54 PM","São diálogos do filme matrix","",""
"937089730615578624","Ƈαριƚãσ Ⴆʅαȥҽ#9594","6/30/2022 11:55 PM","👀","",""
"456226577798135808","Deleted User","6/30/2022 11:55 PM","Morpheus é o Deus do sono","",""
"456226577798135808","Deleted User","6/30/2022 11:55 PM","Que guiará neo na busca da libertação e autoconhecimento","",""
"842078793753427970","skiptags","6/30/2022 11:56 PM","entendi","",""
"842078793753427970","skiptags","6/30/2022 11:56 PM","eu sempre tenho sonhos lúcidos","",""
"456226577798135808","Deleted User","6/30/2022 11:56 PM","Me fala mais deles","",""
"842078793753427970","skiptags","6/30/2022 11:56 PM","eu gosto de voar","",""
"842078793753427970","skiptags","6/30/2022 11:56 PM","e fingir ser uma pessoa normal","",""
"456226577798135808","Deleted User","6/30/2022 11:57 PM","São ao estilo de deja vu?","",""
"456226577798135808","Deleted User","6/30/2022 11:57 PM","Que te faz achar que você é uma pessoa diferente das outras?","",""
"842078793753427970","skiptags","6/30/2022 11:59 PM","eu vivo entre dois mundos, o real e o que eu criei na minha mente","",""
"842078793753427970","skiptags","6/30/2022 11:59 PM","eu tenho meu próprio mundo","",""
"456226577798135808","Deleted User","6/30/2022 11:59 PM","E no seu mundo você é um cara foda?","",""
"456226577798135808","Deleted User","7/1/2022 12:00 AM","Quem você é no seu mundo interior?","",""
"456226577798135808","Deleted User","7/1/2022 12:08 AM","Bem, acho que você foi dormir","",""
"456226577798135808","Deleted User","7/1/2022 12:09 AM","Se você sonha e idealiza algo, isso não faz com que seja menos real que qualquer lembrança que você tenha. As pessoas criam lembranças falsas o tempo todo e não percebem. Pessoas podem se motivar através dessa técnica inteligente.","",""
"456226577798135808","Deleted User","7/1/2022 12:10 AM","Como também podem se desmotivar.","",""
"937089730615578624","Ƈαριƚãσ Ⴆʅαȥҽ#9594","7/1/2022 5:59 AM","Aiai, aqui estou eu mais uma vez perdida... Sei lá, eu me sinto bem mesmo NÃO estando bem
To confusa, indecisa e dividida em relação ao que eu sinto 
As vezes tenho vontade de manda todo mundo tmnc, as vezes quero abraça geral. Quero ficar sozinha e quero compania 
Enfim né, eu e as loucuras kk
Minha mente nesse exato momento se tornou um labirinto com vários caminhos, várias possibilidades e aparentemente sem saída","",""
