AuthorID,Author,Date,Content,Attachments,Reactions
"753227758532034671","mibyon","8/29/2022 11:02 PM","Tenho me sentido muito cansada e fraca esses dias nem mesmo tomando vitaminas a mais e remédios pra dormir tão me ajudando, tenho receio de ficar dependente de remédio pra poder dormir por conta de ter problemas quando não tomo, minha imunidade anda baixa e eu estou pegando muita gripe
Por hora eu estou comendo mais verduras e frutas mas não parece estar dando um resultado ainda","",""
"754059922345558187","Shibito Bana#0440","8/29/2022 11:07 PM","Tente se alimentar com mais vegetais, frutas, tente praticar caminhada em um sol fraco, use máscara","",""
"754059922345558187","Shibito Bana#0440","8/29/2022 11:07 PM","E se aqueça nesse frio","",""
"754059922345558187","Shibito Bana#0440","8/29/2022 11:07 PM","Os problemas com o sono vc irá resolver com o tempo","",""
"209822689928413184","felpi.","8/30/2022 4:54 AM","o que fazer quando a vida começa a dar tudo de pior que podia acontecer, você tenta de todas as formas  ajeitar ou fazer alguma coisa pra sair dessa situação, com tudo o que não podia ficar pior... fica e você vai perdendo as esperanças

não tem mais oq vc possa fazer, só seguir a vida como se nada tivesse acontecido/acontecendo, fingindo que ta tudo bem, sorrindo e mentindo.

você não tem alguem com que possa contar ou simplesmente conversar sobre, na verdade você tem alguem? você realmente tem alguem? 

a unica coisa que você tem é a solidão dentro de você e quanto mais ela cresce, menos vontade vc tem de se abrir, convs e viver.

mais um dia passa em um piscar de olhos, sem que você tenha conseguido sair dessa situação...","",""
"262761745620140033","_sayumi","8/30/2022 2:23 PM","então pare de depender de remédios","",""
"262761745620140033","_sayumi","8/30/2022 2:23 PM","eu passei minha adolescência inteira fudido com esse negócio de sono","",""
"262761745620140033","_sayumi","8/30/2022 2:24 PM","sempre tentando consertar","",""
"262761745620140033","_sayumi","8/30/2022 2:24 PM","sempre, sempre e sempre","",""
"262761745620140033","_sayumi","8/30/2022 2:24 PM","e até hoje to nessa","",""
"262761745620140033","_sayumi","8/30/2022 2:24 PM","e to quase chegando lá","",""
"262761745620140033","_sayumi","8/30/2022 2:24 PM","quanto tempo você ficou assim até querer depender de remédio pra dormir ?","",""
"262761745620140033","_sayumi","8/30/2022 2:25 PM","pra mim, tudo q é problema psicológico ninguém deveria depender de remédio","",""
"262761745620140033","_sayumi","8/30/2022 2:26 PM","remédio deveria ser só uma ajudinha, aquela mão amiga de vez em quando, e não pra ser a solução","",""
"262761745620140033","_sayumi","8/30/2022 2:26 PM","remédio nunca vai ser a solução","",""
"262761745620140033","_sayumi","8/30/2022 2:26 PM","se é isso q você faz, ótimo ,continue assim","",""
"262761745620140033","_sayumi","8/30/2022 2:27 PM","mas há causas simples q te impeça de dormir q podem ter soluções simples tbm q provavelmente você não sabe, então aconselho saber","",""
"786714524413329408","feyngraankein","9/3/2022 7:24 PM","Fui pesquisar por ""vida chata e sem significado"" e apareceu meu nome","",""
"801186251117953035","skwfor","9/3/2022 7:54 PM","Por que chata?","",""
"786714524413329408","feyngraankein","9/3/2022 7:55 PM","Lá vai um resumo do meu dia a dia","",""
"786714524413329408","feyngraankein","9/3/2022 7:58 PM","Acordar, me ajeitar, ir para a escola, passar o dia em um lugar que eu acho detestável, interagir com as duas únicas pessoas que formam meu círculo social com um sério sentimento que eu não sou tão querido por essas duas e só Sirvo de tapa buraco, volta para casa, ficar mechendo no celular, dormir, repetir","",""
"786714524413329408","feyngraankein","9/3/2022 7:59 PM","A parte mais alegre do meu dia é quamdo eu estou dirigindo minha ""mirage 150"" que eu carinhosamente chamo de Gertrudes.","",""
"786714524413329408","feyngraankein","9/3/2022 8:01 PM","Sinceramente minha vida é tão insignificante, chata e tediosa que  é um milagre eu não te me jogando na frente de um caminhão com a Gertrudes","",""
"786714524413329408","feyngraankein","9/3/2022 8:02 PM","Legal é que eu falo que não tenho amigos, quero fazer amigos, mas nesse momento eu tô em uma call mutato com medo de fala","",""
"786714524413329408","feyngraankein","9/3/2022 8:02 PM","Eu tenho uma capacidade bem legal sabe qual é?","",""
"786714524413329408","feyngraankein","9/3/2022 8:03 PM","Ser facilmente ignorado","",""
"786714524413329408","feyngraankein","9/3/2022 8:03 PM","Nem parece que eu tô no local","",""
"786714524413329408","feyngraankein","9/3/2022 8:03 PM","Mas é a vida né","",""
"786714524413329408","feyngraankein","9/3/2022 8:04 PM","Acredito que eu seja uma espécie  d ferro nas mãos de meu Deus","",""
"786714524413329408","feyngraankein","9/3/2022 8:04 PM","Parabse ter um ferro de qualidade  tem que bater bastante.","",""
"801186251117953035","skwfor","9/3/2022 8:05 PM","Bater bastante para ser moldado","",""
"786714524413329408","feyngraankein","9/3/2022 8:05 PM","Ou simplesmente eu seja um porcaria","",""
"786714524413329408","feyngraankein","9/3/2022 8:05 PM","Sem nada de especial","",""
"786714524413329408","feyngraankein","9/3/2022 8:05 PM","Provavelmente a segunda","",""
"801186251117953035","skwfor","9/3/2022 8:06 PM","Algumas de duas informações são interessantes, só o fato que me chama a atenção é que você liga para o seu círculo social e pensa que eles são um buraco que você tampa. Se pensar assim, todos somos tampas buracos, não acha?","",""
"801186251117953035","skwfor","9/3/2022 8:08 PM","Se pensa no fato de sua vida ser uma porcaria agora, não queria saber como vai ser daqui alguns anos. Então seja motivador consigo mesmo, você tem a Gertrudes e aposto que tem mais pessoas especiais em sua vida. Não seja apenas uma porcaria, seja um mero vencedor.","",""
"786714524413329408","feyngraankein","9/3/2022 8:08 PM","Com tapa buraco eu digo uma coisa que só tá ali porque é conveniente","",""
"801186251117953035","skwfor","9/3/2022 8:09 PM","Se eu tivesse uma moto, eu a chamaria de minha amiga.","",""
"786714524413329408","feyngraankein","9/3/2022 8:09 PM","Não faz falta nem é especial","",""
"801186251117953035","skwfor","9/3/2022 8:10 PM","Se afastar é um opção e não se jogar na frente de um caminhão. Eu me afastei de pessoas também, ganhei novas em minha vida e agora o fardo se tornou menos um peso para mim, deixar o mesmo consigo mesmo, é um favor para o ""eu"" do futuro.","",""
"786714524413329408","feyngraankein","9/3/2022 9:00 PM","Se eu me afastar eu perco as duas únicas """"amizades"""" que eu conseguir fazer em 4 anos Tentando.
É tipo um relacionamento abusivo  essa merda","",""
"786714524413329408","feyngraankein","9/3/2022 9:02 PM","Ahr
Provavelmente eu só não fui feito pra esse tipo de coisa.
Talvez meu módulo sentimental/social esteja estragado.","",""
"786714524413329408","feyngraankein","9/3/2022 9:03 PM","Não lembro a última vez que eu chorei. Isso é triste de certa forma.
Eu estou em um estado constante de tristeza, mas não consigo por para fora de forma adequada.","",""
"786714524413329408","feyngraankein","9/3/2022 9:04 PM","Sabe","",""
"786714524413329408","feyngraankein","9/3/2022 9:06 PM","Sou muito grato a pessoa que criou esse servidor.
Aqui eu posso dizer essas coisas e só fingir para minha família que eu so sou um pouco sério para além da conta.","",""
"801186251117953035","skwfor","9/3/2022 9:06 PM","Uma amizade abusiva, mais um princípio para você sair fora disso. Viver em constante tristeza é quebrar um vício, ache-o e quebre-o  de certa maneira que nunca mais vai sentir isso.","",""
"801186251117953035","skwfor","9/3/2022 9:08 PM","Feliz em saber disso. Mais não fique assim, olhe ao seu redor e veja o quanto a vida tem a te oferecer, não esquente e cabeça com amizades ou aquele aperto preto no seu peito, expresse isso, escrevendo, pintando ou algo assim, li sobre isso em um livro sobre féericos.","",""
"801186251117953035","skwfor","9/3/2022 9:09 PM","O que está de machucando, em minha concepção são as suas amizades que te deixam para baixo de tal maneira, se você conseguisse ver o quando é especial, saberia disso.","",""
"786714524413329408","feyngraankein","9/3/2022 9:11 PM","Eu nem sei oque dizer","",""
"786714524413329408","feyngraankein","9/3/2022 9:11 PM","Tudo tá tão estranho","",""
"786714524413329408","feyngraankein","9/3/2022 9:12 PM","Eu já tentei ver alguma cois de especial em min","",""
"786714524413329408","feyngraankein","9/3/2022 9:12 PM","Acabei ficando assustado com o quão desagradável eu sou","",""
"786714524413329408","feyngraankein","9/3/2022 9:13 PM","Eu meio que consigo ser um emissor de negatividade","",""
"786714524413329408","feyngraankein","9/3/2022 9:13 PM","Aí percebi o porquê de ser tão solitário.","",""
"786714524413329408","feyngraankein","9/3/2022 9:14 PM","Eu só não consigo ver nem um tipo de luz saindo de min","",""
"786714524413329408","feyngraankein","9/3/2022 9:15 PM","Apenas um buraco","",""
"786714524413329408","feyngraankein","9/3/2022 9:15 PM","Vazio","",""
"786714524413329408","feyngraankein","9/3/2022 9:15 PM","Sem serventia para ninguém","",""
"786714524413329408","feyngraankein","9/3/2022 9:16 PM","Ansiando por alguma coisa possa me preencher.
Mas é claro que não existe alguma coisa como isso.","",""
"786714524413329408","feyngraankein","9/3/2022 9:17 PM","Ok
Agora esse velho saco de ossos irá retornar a sua vida fingindo que ele ainda tem esperança.","",""
"786714524413329408","feyngraankein","9/3/2022 9:18 PM","Boa noite senhores e senhoras.","",""
"801186251117953035","skwfor","9/3/2022 9:50 PM","Não pense deste modo nagativo, tem que pensar que tudo é bom e tem uma causa e uma relação, não é simplismente aceitar tudo isso e viver com esses fatos enjoativos, é encarar eles e acordar com disposição para mudar a situação , afinal uma mudança gera mudança e forma uma futuro melhor","",""
"801186251117953035","skwfor","9/3/2022 9:50 PM","Boa noite.","",""
"354012338938183685","jury_rigg","9/3/2022 10:43 PM","Hoje eu comecei meu curso... 
Ela estava lá...
Coincidentemente 
Nem olhou na minha cara
Como se eu fosse só mais um no meio daquela gente","",""
"801186251117953035","skwfor","9/4/2022 10:12 PM","Amor? Pessoa do passado? Não se culpe por isso, no final das contas, amar é saber lidar com os deifetos da outra pessoa.  Mais se é um amor novo, vá com cautela e com cuidado.","",""
"786714524413329408","feyngraankein","9/4/2022 10:35 PM","Amor não existe mano
Ele é apenas o resultado de um bombardeio de hormônios assim como o ódio e toda essa coisa de sentimento","",""
"786714524413329408","feyngraankein","9/4/2022 10:35 PM","Fica tranquilo que o passado pode te condenar mas não te machucar","",""
"754059922345558187","Shibito Bana#0440","9/4/2022 11:45 PM","Discordo. O amor é algo que se da para cultivar","",""
"754059922345558187","Shibito Bana#0440","9/4/2022 11:46 PM","Como o amor pela música, ou o amor pela filosofia. Algm que tem paixão por algo ela se consome, como dois jovens apaixonados se beijando parece que o mundo parou, ou a paixão por ler você perde as horas lendo, tudo começa em etapas agora o que depende é da pessoa transformar em algo a mais","",""
"754059922345558187","Shibito Bana#0440","9/4/2022 11:47 PM","Se não houvesse amor não tinha pq alguns pais se matarem para dar tudo aos filhos, não teria razão alguns animais serem tão leais aos donos","",""
"456226577798135808","Deleted User","9/4/2022 11:52 PM","Na escola eu tenho explodido com frequência. Sinto que estou sendo julgado, repudiado com olhares ou qualquer outro tipo de julgamento terceiro. Mesmo não me importando com reais julgamentos, fico inseguro em discernir se quem está ao meu lado realmente é um amigo. 
Como consequência disso, acabo considerando comentários que nem sempre são mal intencionados, acabo explodindo, proferindo palavras que possam ofender à pessoa, ou até mesmo ropendo ou agredindo uma posse sua mas sem intenção de quebrar ou ferir gravemente. 
Meus pais sempre dizem que vão me levar ao psicologo, mas eu vou aguardando e no final é sempre o mesmo papo furado, eu moro afastado de tudo e em um bairro perigoso, então meus pais são sempre na minha bota e eu até entendo pra dizer a realidade. Como buscar uma ajuda profissional não tem sido uma opção, busquei estudar mais sobre esses meus surtos e ao que tudo indica eu tenho TEI - Transtorno Explosivo Intermitente. Me arrependo quase que instantaneamente dos meus surtos de raiva, mas mal posso controlá-los 

As pessoas tem cada vez se afastado de mim, e eu tô me sentindo muito só... Foi tarde até eu perceber que o problema estava dentro de mim, sempre achei que as pessoas que tinham certo preconceito ou algo do tipo, mas sempre fui eu que as afastei","",""
"456226577798135808","Deleted User","9/4/2022 11:54 PM","Sempre tive amor à vida, mas nunca foi uma opção vivê-la dessa forma, sem ninguém, sem dias de curtição ou distração...","",""
"354012338938183685","jury_rigg","9/5/2022 12:11 AM","Já tem 5 anos que essa me iludiu","",""
"354012338938183685","jury_rigg","9/5/2022 12:12 AM","Mas, depois dessa aí não teve outra
Ela que me fez desistir","",""
"754059922345558187","Shibito Bana#0440","9/5/2022 12:59 AM","Tenha calma","",""
"754059922345558187","Shibito Bana#0440","9/5/2022 1:00 AM","Você conseguirá fazer mais amizades, porém acho que deveria ir ao psicólogo mesmo, apenas com tratamento para tratar disso","",""
"754059922345558187","Shibito Bana#0440","9/5/2022 1:00 AM","Aconselho que faça coisas para descarregar e que não confie totalmente em algm de cara","",""
"754059922345558187","Shibito Bana#0440","9/5/2022 1:01 AM","Leve um tempo, e va depositando confiança aos poucos","",""
"801186251117953035","skwfor","9/5/2022 12:29 PM","Olha, você pode mudar de caminho toda vez que ver ela. Sei pelo que passou, eu também já passei por isso, e agora não sinto mais nada pela pessoa que sentia. Talvez ainda não tenho superado ou ja superou, tudo o que aconteceu no momento foi uma lembrança do passado, um dica que dou é destrair a sua mente, sair para caminhar ou andar é bom. Espero que fica bem, e não desacredite no amor, quando você menos esperar ele vai aparecer novamente, sempre fui desses e agora achei um alguém ou quase, mas ela é especial.","",""
"262761745620140033","_sayumi","9/5/2022 7:37 PM","pq tu quer ser especial pra essas pessoas ?","",""
"262761745620140033","_sayumi","9/5/2022 7:39 PM","você consegue contar quantas vezes tu está consciente de tudo num dia ?","",""
"354012338938183685","jury_rigg","9/5/2022 9:46 PM","Acho que só esqueço isso depois que achar outra","",""
"354012338938183685","jury_rigg","9/5/2022 9:46 PM","@Skwfor sumiu a aba de conquistas?","",""
"354012338938183685","jury_rigg","9/5/2022 9:47 PM","Ah, trocou de nome
Deixa pra lá","",""
"786714524413329408","feyngraankein","9/6/2022 8:11 AM","Meio que ter a relevância de uma cadeira em tudo quanto é canto que se encontra acaba te deixando meio fragilizado.","",""
"262761745620140033","_sayumi","9/6/2022 2:06 PM","pq ?","",""
"801186251117953035","skwfor","9/6/2022 2:27 PM","Por que? Seja feliz sozinho, não precisa achar outra para isso, tenho certeza disso.","",""
"786714524413329408","feyngraankein","9/6/2022 6:00 PM","Sempre que eu estou em uma call aqui no discord eu nunca consigo falar nada já que ninguém para pra escutar. Resultado: eu não entro mais em call","",""
"786714524413329408","feyngraankein","9/6/2022 6:00 PM","É desse tipo de coisa que eu tô falando","",""
"262761745620140033","_sayumi","9/6/2022 6:20 PM","mas você precisa dessas pessoas ?","",""
"262761745620140033","_sayumi","9/6/2022 6:20 PM","precisa conversar com elas ?","",""
"354012338938183685","jury_rigg","9/6/2022 10:10 PM","Nem todos são como Paulo","",""
"786714524413329408","feyngraankein","9/6/2022 10:27 PM","Já tentou ficar uma semana sem ter com quem falar?
Ficar o final de semana deitado por não ter nada pra fazer nem onde ir?
Já teve uma conquista mas não teve pra quem contar?
É pesado meu mano.
Já teve vez que eu fiquei tão solitário que eu ficava me mordendo pra amenizar aquela merda.
""Auto mutilação não é a resposta""","",""
"262761745620140033","_sayumi","9/6/2022 10:32 PM","tentei não, já fiquei assim inevitavelmente, mas toda a angústia q eu sempre sentia por não ter ninguém pra conversar eu refleti q era uma necessidade q meu cérebro sentia de saciar mas q não era necessário saciar APENAS em outras pessoas","",""
"262761745620140033","_sayumi","9/6/2022 10:45 PM","muitas vezes eu mesmo já sirvo pra suprir essas necessidades","",""
"262761745620140033","_sayumi","9/6/2022 10:46 PM","ou eu posso simplesmente me habituar a suprir minhas necessidades em outros deveres q não envolvam outras pessoas","",""
"262761745620140033","_sayumi","9/6/2022 10:46 PM","ainda pode fazer falta ter pessoas pra socializar ? até pode","",""
"262761745620140033","_sayumi","9/6/2022 10:46 PM","mas é aquele negócio né meu fi, se tu quer algo você corre atrás","",""
"262761745620140033","_sayumi","9/6/2022 10:47 PM","alguma hora tu vai achar as pessoas certas pra socializar","",""
"262761745620140033","_sayumi","9/6/2022 10:50 PM","e tu pode tar deixando seus desejos nesse meio social saírem fora de controle, tem q ver isso tbm","",""
"801186251117953035","skwfor","9/7/2022 2:03 PM","Vai conseguir viver sem essa pessoa, basta superar ela, coisa que vai vim aos poucos dependendo de como foi a vivência de vocês","",""
"354012338938183685","jury_rigg","9/7/2022 2:49 PM","Sem essa certamente, sem nenhuma, acho difícil","",""
"801186251117953035","skwfor","9/8/2022 9:24 PM","Já me senti assim, talvez não o quando você sente por essa pessoa, é complicado esquecer uma pessoa que tanto gostou. Eu por exemplo tomava como inciativa não encontar com a pessoa x na escola e ocupar o meu tempo até na hora de dormir isso fez efeito com o passar do tempo, para ser sincero é tudo o que fiz esse tempo todo, mais não fique remoendo isso dentro de você o que eu tinha me transformou em uma pessoa muito...estranha e encomodada com tudo.","",""
"801186251117953035","skwfor","9/8/2022 9:25 PM","Não desejo isso para os outros.","",""
"354012338938183685","jury_rigg","9/8/2022 9:42 PM","Eu me identifiquei com o final...","",""
"801186251117953035","skwfor","9/8/2022 9:48 PM","Não se transforme nesse...que eu me transformei, não sei se acretida em Deus, mais ele sabe o quanto existe escuridão dentro de mim por conta de tudo isso, fica na boa menino, tome um chá e descanse se der tire o dia para ser você mesmo, você mesmo menos tudo o que eu sou agora.","",""
"354012338938183685","jury_rigg","9/8/2022 10:13 PM","Tem escuridão dentro de todos nós...","",""
"801186251117953035","skwfor","9/8/2022 10:21 PM","Só aprende a lidar com ela, caso exista uma dentro de você e se não existe nada, coisa que é difícil, então agradeça aos céus.","",""
"354012338938183685","jury_rigg","9/9/2022 10:06 AM","🤔","",""
"801186251117953035","skwfor","9/9/2022 10:24 AM","Para você aprender a conviver com essa escuridão dentro de você","",""
"456226577798135808","Deleted User","9/10/2022 10:04 PM","Difícil","",""
"262761745620140033","_sayumi","9/10/2022 10:07 PM","caraca KKK","",""
"262761745620140033","_sayumi","9/10/2022 10:07 PM","meio milhão de anos depois...","",""
"262761745620140033","_sayumi","9/10/2022 10:09 PM","a consciência é a parte educada e racional do seu cérebro","",""
"262761745620140033","_sayumi","9/10/2022 10:09 PM","se em grande parte do dia você nunca está consciente de tudo no interior e no exterior","",""
"262761745620140033","_sayumi","9/10/2022 10:09 PM","dificilmente tu vai segurar essas crises","",""
"262761745620140033","_sayumi","9/10/2022 10:10 PM","o seu lado consciente é aquele q consegue educar seu lado inconsciente, o lado selvagem, instintivo, emocional e etc","",""
"931677232303321088","ezequiel_b","9/12/2022 10:58 AM","Não posso te fazer mais feliz, não posso te tirar dessa rotina desgastante, não posso eliminar teus traumas, não posso dar uma qualidade de vida melhor para você. 3000km nos separam, amiga, em 3 anos de amizade nunca antes houve uma época mais sombria na tua vida. Queria eu poder ser deus e te fazer mais alegre.","",""
"931677232303321088","ezequiel_b","9/12/2022 11:01 AM","Impotência. Fraco demais para fazer algo, longe demais para fazer. Mas não é sobre minha infelicidade nessa situação, ela é pequena comparada a tua.","",""
"931677232303321088","ezequiel_b","9/12/2022 11:02 AM","Espero logo que essa fase passe, que tudo ocorra bem. O mundo ficaria mais escuro sem você, Sky.","",""
"754059922345558187","Shibito Bana#0440","9/12/2022 3:38 PM","Torço por vcs","",""
"254312604418179085","uaiii","9/14/2022 7:36 PM","Meu Deus, eu me odeio, eu sempre me odiei, até quando vou viver como coadjuvante da minha própria história?","",""
"747951179375575121","Oil#9359","9/14/2022 9:41 PM","pode ser difícil cumprir o que eu vou te dizer agora, mas você tem que tomar o rumo da própria vida, lutar para cumprir seus sonhos e tomar decisões sozinha na maioria das vezes, todos nós somos protagonistas da nossas próprias vidas, basta levantar e lutar por si mesma, pelos seus sonhos, família, amigos etc..","",""
"254312604418179085","uaiii","9/14/2022 10:09 PM","Não me refiro a sonhos de carreira nem familia quando digo isso, hoje me peguei tendo crises de ansiedade dnv ao sair em público, eu odeio minha aparência, e odeio o fato de nunca ter sido ou estar sendo quem eu realmente sou, de nunca agradar ninguém, nem a mim mesma. Eu odeio o fato de me sentir uma figurante no mundo, de sentir q nunca tive tanta importância para as pessoas, de nunca ter sido levada muito a sério nem ouvida quando eu necessitava falar, quando minha garganta doia e eu tremia querendo falar, e quando finalmente colocava algo pra fora eu gaguejava e parecia uma idiota. Nunca senti q fiz/faço diferença na vida de ninguém, tbm nunca fiz diferença em minha própria vida, eu queria assumir um estilo diferente, uma nova identidade, queria ser mais sociável, e ter mais amigos, ser alguém q as pessoas queiram ter por perto, queria conseguir me olhar no espelho, queria conseguir me sentir bonita,mas a verdade é q eu não me suporto, eu me detesto, e detesto essa construção de quem eu sou na cabeça das pessoas pq sinto q elas me enxergam como uma boba, tenho total culpa nisso pq sempre devo ter agido como uma, nunca me encaixei, nunca me deixei encaixar pq me incomodava, me sentia de fora. Sou culpada por hj ser uma garota tola, e não sei mudar, quero mas não sei, sinto q me perdi...","",""
"754059922345558187","Shibito Bana#0440","9/14/2022 10:22 PM","As vezes as coisas são difíceis, mudar é difícil. É difícil colocar para fora o que pensa, é difícil se aceitar, é difícil assumir responsabilidades pelas próprias ações. Mas o primeiro passo que alguém tem que fazer para se aceitar é enfrentar, é pegar o último ânimo, a última coragem que tem e ir com tudo pra cima, porque se não enfrentar, as coisas não mudam. Você tem que ir e nunca parar, para mudar seu estilo pega e vai, muda o corte de cabelo, tipo minha irmã, estilo dela é bem moderno, usa roupas sociais e cabelo curto, curto mesmo, joaozinho. Mas você tem que ter coragem, e se alguém perguntar o motivo você diz porque queria testar. Porque quero me achar. É complicado começar do zero, mas sempre dá. 
Se aceitar também, é complicado, complicadíssimo, mas a gente tem que fazer isso. Não adianta em um momento se achar a pessoa mais daora que tem e meses, semanas, dias, horas, minutos depois não conseguir nem se olhar. Você tem que começar de algum lugar, a gente não precisa se encaixar, não somos quebra cabeças, somos pessoas, você pode ficar aonde quiser. E quem se importa em ter centenas de amigos e quando mais precisar, quando tiver na necessidade todo mundo só dar o foda-se? O que importa é ser você por si, esse é o primeiro mandamento. Depois você encontra amizades, depois você faz o que quiser, mais o primeiro de tudo é conviver com si mesma, conviver com suas ações, porque não adianta você querer ter o mundo nas mãos, mas não conseguir conviver com si mesma.","",""
"668519558943997982","logoff12","9/14/2022 10:27 PM","Faço das palavras da Saionara as minhas, não tem muito o que adicionar em meu textinho, só quero que saiba que ninguém te acha tola ou boba, pelo menos eu nunca achei, você é uma boa amiga e uma ótima companheira. Não se acostume com essas palavras, não vou dize-las novamente tão cedo.","","solove (1)"
"254312604418179085","uaiii","9/14/2022 10:31 PM","Obrigada minha flor","",""
"254312604418179085","uaiii","9/14/2022 10:31 PM","Tirei até print, obrigada migo!","",""
"668519558943997982","logoff12","9/14/2022 10:31 PM","=-=","",""
"754059922345558187","Shibito Bana#0440","9/14/2022 10:33 PM","Por alguma razão deu um shipp na minha cabeça","",""
"754059922345558187","Shibito Bana#0440","9/14/2022 10:34 PM","Mas lembrei que a Uai é comprometida","",""
"754059922345558187","Shibito Bana#0440","9/14/2022 10:34 PM","Não foi nada","",""
"668519558943997982","logoff12","9/14/2022 10:34 PM","Um shipp entre eu e você? Esse eu aceito","",""
"754059922345558187","Shibito Bana#0440","9/14/2022 10:35 PM","Deus me livre","",""
"754059922345558187","Shibito Bana#0440","9/14/2022 10:35 PM","Vc e a Uai","","emoji_15 (1)"
