AuthorID,Author,Date,Content,Attachments,Reactions
"739981590746103939","skoqmsosowkanzoqqokaakkqqssh","4/2/2023 10:39 PM","não é algo besta, vc fez o que muitos não tem coragem... contar para alguém.
você foi apenas mais uma vítima dessa coisa repugnante, mas que bom que você está tentando vencer isso, e cara... apenas não pare de tentar!
recaídas são comuns, então não se culpe por isso.
aprenda com os seus erros e evite certos gatilhos que te induzem a querer ver *****grafia (mesmo que sejam apenas memes, vídeos, anúncios, sites etc.)
procure praticar coisas que tomem o seu tempo, pois assim vai ficar bastante ocupado e não terá tempo para querer ver esse tipo de conteúdo... qualquer coisa busque ajuda de um profissional, e sempre converse e peça conselhos à pessoas de confiança (que queiram te ajudar de verdade).
dica bônus: sempre que se sentir tentado a acessar certos sites, se jogue no chão e faça exercícios físicos até o desejo passar 😉","",""
"1061761013223018508","magma_jira","4/2/2023 10:49 PM","eu acho complicado, mesmo q eu bloqueie os sites, tem outras coisas tipo memes e etc. até a menor das coisas dá gatilho infelizmente 😔","",""
"254312604418179085","uaiii","4/2/2023 10:50 PM","Amigo, é oq eu falei... Você está na fase de estar a mercê desses impulsos mesmo, mas como disse a melhor maneira de vencer um vício é ir cortando as raízes, e ter paciência com vc mesmo.","",""
"254312604418179085","uaiii","4/2/2023 10:51 PM","Tudo em excesso faz mal, tudo","",""
"254312604418179085","uaiii","4/2/2023 10:51 PM","Procure se policiar","",""
"254312604418179085","uaiii","4/2/2023 10:51 PM","Não tem outro jeito","",""
"1061761013223018508","magma_jira","4/2/2023 10:51 PM","eu entendo, mas ao mesmo tempo eu quero fazer isso do jeito mais rápido possivel ksksksks
faz tempo q eu to nessa situação, só há pouco tempo q eu criei coragem de me expor assim","",""
"254312604418179085","uaiii","4/2/2023 10:52 PM","Kkkkk então começa a ter paciência contigo  e entender q é um processo, não vai mudar de uma hora pra outra","",""
"254312604418179085","uaiii","4/2/2023 10:53 PM","Sobre se expor, todo mundo sente desejo, é normal, é da natureza.
Você nao é um monstro por isso","",""
"254312604418179085","uaiii","4/2/2023 10:53 PM","Se precisar de conselhos ou de algum ombro amigo eu estou aqui","",""
"254312604418179085","uaiii","4/2/2023 10:53 PM","Você é um rapaz de um coração mt bom","",""
"1061761013223018508","magma_jira","4/2/2023 10:58 PM","mas e se esses desejos são ""errados""? 
em praticamente todo lugar é considerado errado, logo me sinto ruim por causa disso
sinto que tenho que ser punido por ter tido esses ""desejos""","",""
"254312604418179085","uaiii","4/2/2023 11:00 PM","A questão é q nao são migo kkkk somos animais tbm, e o desejo faz  parte do que somos.
Eu jamais iria te culpar e te fazer reprimir as coisas, o ponto aqui é como vc lida com ele, como voce vai fazer com que isso deixe de ser algo que  atrapalhe sua vida, pq sumir isso não vai.","",""
"254312604418179085","uaiii","4/2/2023 11:01 PM","Eu adoraria sla pagar de falsa moralista, viver num conto de fadas e dizer ""vai pra igreja orar seu pecadorzinho de merda e  viva uma vida de castidade""","",""
"254312604418179085","uaiii","4/2/2023 11:01 PM","Mas não funciona assim","",""
"254312604418179085","uaiii","4/2/2023 11:02 PM","Tudo na vida depende de como vc vai lidar","",""
"254312604418179085","uaiii","4/2/2023 11:03 PM","Tenha paciência com você, e com o tempo cortando as raízes disso, evitando e se policiando vc vai conseguir fazer com que isso deixe de ser um atraso ou questão de preocupação na sua vida","",""
"254312604418179085","uaiii","4/2/2023 11:03 PM","Não vai sumir, mas vc vai saber lidar","",""
"254312604418179085","uaiii","4/2/2023 11:03 PM","Da forma mais saudável possivel","",""
"254312604418179085","uaiii","4/2/2023 11:04 PM","E eu sei q vc consegue, procure relatos, procure  conselhos de outras pessoas talvez","",""
"254312604418179085","uaiii","4/2/2023 11:04 PM","O meu possa ser de grandes 0 utilidades pra ti","",""
"254312604418179085","uaiii","4/2/2023 11:04 PM","Mas é sincero","",""
"1061761013223018508","magma_jira","4/2/2023 11:22 PM","entendo, obrigado pelos conselhos! @deleted @why?  
vou tentar aplicar eles, com paciencia é claro 
se eu fizer algum progresso, eu aviso","","🖤 (1)"
"1061761013223018508","magma_jira","4/2/2023 11:22 PM","❤️","",""
"1061761013223018508","magma_jira","4/2/2023 11:42 PM","imagina kkkk, foi util sim!","",""
"752191242229776435","micael_yeager","4/3/2023 8:48 AM","Se serve de consolo.... nessa idade tá normal ksk hormônios","",""
"752191242229776435","micael_yeager","4/3/2023 8:49 AM","Parar de uma vez não é bom, se for um vício, o melhor é diminuir a quantidade de vezes que ele vê isso aos poucos até chegar no mínimo","",""
"752191242229776435","micael_yeager","4/3/2023 8:52 AM","Castidade aí já é de mais tbm... @magma  é como remédios vc tem que diminuir aos poucos talvez não consiga ficar sem mas talvez consiga controlar e fazer isso raramente sabe o mínimo acho que aí isso não iria te atrapalhar","",""
"752191242229776435","micael_yeager","4/3/2023 8:53 AM","@magma  qual a quantidade de vezes por dia que vc pensa nisso ?","",""
"752191242229776435","micael_yeager","4/3/2023 8:57 AM","E não precisa ter vergonha vai ser mentira se alguém dizer que nunca fez isso ksk","",""
"752191242229776435","micael_yeager","4/3/2023 8:58 AM","Ainda mais na adolescência","",""
"752191242229776435","micael_yeager","4/3/2023 8:59 AM","E o problema nem é isso, mas sim como isso lhe afeta na vida pessoal","",""
"254312604418179085","uaiii","4/3/2023 9:00 AM","Mermão, no caso dele tu acha mesmo q ele vai ficar pensando em diminuir aos poucos? Kkkkk ""ah hj vai ser só  2, amanhã só  1"" calma lá né kkkkk","",""
"254312604418179085","uaiii","4/3/2023 9:00 AM","Entendi oq quis dizer","",""
"254312604418179085","uaiii","4/3/2023 9:00 AM","Mas é conto de fadas","",""
"752191242229776435","micael_yeager","4/3/2023 9:00 AM","Cortar de uma vez é mais difícil","",""
"254312604418179085","uaiii","4/3/2023 9:00 AM","Ele só precisa parar com esses estímulos visuais","",""
"752191242229776435","micael_yeager","4/3/2023 9:00 AM","Aos poucos diminui até ele ver que não precisa mais disso","",""
"254312604418179085","uaiii","4/3/2023 9:00 AM","Vai nessa","",""
"752191242229776435","micael_yeager","4/3/2023 9:01 AM","De uma vez qualquer vício é difícil parar ksk vc para aos poucos , igual fumante","",""
"254312604418179085","uaiii","4/3/2023 9:01 AM","Tá mas não adianta falar isso pra ele, sozinho ele não consegue","",""
"254312604418179085","uaiii","4/3/2023 9:02 AM","Precisa bloquear os sites, e evitar qualquer coisa q estimule ele a buscar o porno.
Procurar fazer isso de uma maneira moderada e saudável","",""
"752191242229776435","micael_yeager","4/3/2023 9:03 AM","Olha acho que ele tem que tentar né ? Já conheci gente assim e oque me contaram é que diminuíram até chegar a uma ou duas vezes na semana, sabe conseguir controlar os estímulos","",""
"254312604418179085","uaiii","4/3/2023 9:03 AM","Que seja, o meu conselho foi aquele.","",""
"752191242229776435","micael_yeager","4/3/2023 9:03 AM","Bloquear os sites tbm ajuda","",""
"254312604418179085","uaiii","4/3/2023 9:03 AM","Jura?","",""
"752191242229776435","micael_yeager","4/3/2023 9:04 AM","Mas é só bloquear no Google já tem essa função ,_,,","",""
"752191242229776435","micael_yeager","4/3/2023 9:04 AM","Xau , começo aula ksk","",""
"254312604418179085","uaiii","4/3/2023 9:06 AM","Tinha um conselho melhor, mas talvez se eu dissesse aqui  eu seria a errada","",""
"752191242229776435","micael_yeager","4/3/2023 9:13 AM","Conselho pra ele ?","",""
"752191242229776435","micael_yeager","4/3/2023 9:13 AM","Bem quanto mais conselho melhor , o meu foi ele diminuir quantidade aos poucos e não parar de vez , aí a abstinência é menor","",""
"912779657705840690","https.kauan","4/3/2023 10:13 AM","Eu também tenho infelizmente","",""
"912779657705840690","https.kauan","4/3/2023 10:13 AM","Antigamente eu conseguia me manter um dia sim longe e um dia não","",""
"912779657705840690","https.kauan","4/3/2023 10:13 AM","Mais hoje em dia e todo dia","",""
"752191242229776435","micael_yeager","4/3/2023 10:42 AM","Desmotiva o cara não ,_,","",""
"1061761013223018508","magma_jira","4/3/2023 12:05 PM","O problema é que se eu entrar em contato com aquilo pelo menos 1 vez por dia, eu vou querer mais","",""
"1061761013223018508","magma_jira","4/3/2023 12:05 PM","Ai tudo cai aos pedaços","",""
"752191242229776435","micael_yeager","4/3/2023 12:05 PM",",_,","",""
"752191242229776435","micael_yeager","4/3/2023 12:05 PM","Po mano tem que se controlar ksk","",""
"752191242229776435","micael_yeager","4/3/2023 12:08 PM","Faz quanto tempo ? Que isso vem te atrapalhando","",""
"1061761013223018508","magma_jira","4/3/2023 12:09 PM","Uns 6 anos eu acho","",""
"752191242229776435","micael_yeager","4/3/2023 12:09 PM","Digo a quanto tempo isso te atrapalha na vida pessoal","",""
"752191242229776435","micael_yeager","4/3/2023 12:09 PM","Que vc percebeu que tá fazendo mal","",""
"1061761013223018508","magma_jira","4/3/2023 12:12 PM","Ah","",""
"1061761013223018508","magma_jira","4/3/2023 12:13 PM","Uns 3 então","",""
"912779657705840690","https.kauan","4/3/2023 1:26 PM","tem coisas atrativas envolvendo essas paradas aí em todo lugar","",""
"912779657705840690","https.kauan","4/3/2023 1:26 PM","Por isso e tão difícil largar esse vicio","",""
"912779657705840690","https.kauan","4/3/2023 1:27 PM","Eu até te entendo","",""
"912779657705840690","https.kauan","4/3/2023 1:27 PM","Tenho o mesmo problema","",""
"456226577798135808","Deleted User","4/3/2023 2:56 PM","Isso daí só é verdade para moradores de rua, porque se eles tiverem uma crise de abstinência (vômito, diarreia, espasmos) no meio do concreto, é morte certa.
Moradores de rua viciados em drogas pesadas precisam sim ir diminuindo aos poucos, porque é questão de vida e morte. 
Mas isso não tem nada a ver com o caso dele. Ele precisa cortar tudo, de uma vez, para sempre.","",""
"456226577798135808","Deleted User","4/3/2023 2:57 PM","""Ah, mas você acha que ele vai conseguir?""
Não.","",""
"752191242229776435","micael_yeager","4/3/2023 2:57 PM","Oque tem aver isso aí ? ,_,","",""
"752191242229776435","micael_yeager","4/3/2023 2:57 PM","Tu é bom em motivação ,_,","",""
"456226577798135808","Deleted User","4/3/2023 2:57 PM","Não é pra conseguir de primeira, mas sim ir tentando aos poucos parar de uma vez só.","",""
"456226577798135808","Deleted User","4/3/2023 2:57 PM","Sinceridade antes de tudo.","",""
"456226577798135808","Deleted User","4/3/2023 2:58 PM","Nenhum viciado larga a droga de primeira. Isso não existe kkk.","",""
"456226577798135808","Deleted User","4/3/2023 2:58 PM","Mas o objetivo é esse.","",""
"456226577798135808","Deleted User","4/3/2023 2:58 PM","Qualquer outro objetivo não funciona.","",""
"456226577798135808","Deleted User","4/3/2023 3:00 PM","""Fazer isso de forma moderada e saudável"" também não adianta muito, infelizmente. 
A tendência é que ele tente levar a pornografia pra dentro do relacionamento.","",""
"456226577798135808","Deleted User","4/3/2023 3:01 PM","Infelizmente a melhor solução a curto prazo é trocar um vício por outro.","",""
"456226577798135808","Deleted User","4/3/2023 3:01 PM","Não é à toa que muita, muita gente larga vício de bebida por vício de academia.","",""
"456226577798135808","Deleted User","4/3/2023 3:02 PM","Também não é coincidência que muitas pessoas que faziam academia regularmente viraram alcoólatras durante a pandemia.","",""
"752191242229776435","micael_yeager","4/3/2023 3:02 PM","Por isso ir diminuindo aos poucos","",""
"752191242229776435","micael_yeager","4/3/2023 3:03 PM","Nenhum psicólogo ou terapia de qualquer coisa vão te mandar parar de uma vez em algo ksks é sempre aos poucos","",""
"456226577798135808","Deleted User","4/3/2023 3:03 PM","Não, ir tentando várias, várias, várias vezes largar de uma vez.","",""
"752191242229776435","micael_yeager","4/3/2023 3:03 PM","Não funciona assim meu caro ,_,","",""
"456226577798135808","Deleted User","4/3/2023 3:03 PM","E buscando outras coisas para substituir o tempo que ele usava na droga.","",""
"456226577798135808","Deleted User","4/3/2023 3:04 PM","Você já largou algum vício anjo?","",""
"752191242229776435","micael_yeager","4/3/2023 3:04 PM","O cara não usa isso não viu ,_,","",""
"456226577798135808","Deleted User","4/3/2023 3:04 PM","Eu sei, mas vale também.","",""
"456226577798135808","Deleted User","4/3/2023 3:04 PM","No caso de tempo, energia.","",""
"456226577798135808","Deleted User","4/3/2023 3:04 PM","A energia que ele usa pra buscar isso podia ser usada de outras maneiras.","",""
"456226577798135808","Deleted User","4/3/2023 3:05 PM","Sejam físicas ou criativas.","",""
"456226577798135808","Deleted User","4/3/2023 3:05 PM","Isso se chama transmutação da energia sexual.","",""
"456226577798135808","Deleted User","4/3/2023 3:06 PM","Que é uma energia natural dos nossos hormônios, mas quando usada errada dá nisso.","",""
"752191242229776435","micael_yeager","4/3/2023 3:10 PM","Academia ? ,_, ficar sem energia pra nada","",""
"456226577798135808","Deleted User","4/3/2023 3:12 PM","Depende do que você for fazer né brabo kkk","",""
"456226577798135808","Deleted User","4/3/2023 3:13 PM","Nem todo mundo precisa, mas pra quem não trabalha com nada muito físico, é uma ótima opção pra usar os hormônios.","",""
"456226577798135808","Deleted User","4/3/2023 3:14 PM","Porque é uma força que nos move, como se fosse uma mangueira. Você pode até tapar a ponta, mas a água vai sair por algum lugar.","",""
"752191242229776435","micael_yeager","4/3/2023 3:14 PM","Bem como já dizia um médico que conheci, antes na saúde que sem a saúde ,_,","",""
"456226577798135808","Deleted User","4/3/2023 3:15 PM","A diferença é que você pode aprender a direcionar ela ou deixar ela dominar a sua vida.","",""
"752191242229776435","micael_yeager","4/3/2023 3:15 PM","Aprender a Controlar","",""
"456226577798135808","Deleted User","4/3/2023 3:17 PM","","https://cdn.discordapp.com/attachments/985552176476737626/1092513235602776105/deps2q6xg9f11.jpg?ex=6518663d&is=651714bd&hm=e8a4c193f6a409ba3fc6a21822d1113d61a9d47a50aa380129a93b727f88578e&","❤️ (1)"
"801186251117953035","skwfor","4/19/2023 10:09 PM","É eu sinto que parte minha está morrendo. Eu sou bom demais para um mundo cruel? Não sei se as minhas ações vai valer daqui um tempo, se a minha existência vai ser notada ou se simplismente vai fazer a diferença, sinto que em todos os lugares que estou não sou visto ou que uma boa minha morre todos os dias, já que sinto não ser forte o bastante para poder suportar tudo isso.
É como se fosse um poço de água, as pessoas sempre retiram água, mais nunca existe chuva para poder encher esse poço, no final esse poço sou eu, sempre sozinho e na companhia da escuridão.","",""
"909861761446981642","Novembrode1996#7749","4/19/2023 10:25 PM","Oiii","",""
"909861761446981642","Novembrode1996#7749","4/19/2023 10:27 PM","Eu me sinto assim as vezes, eu tenho Toc, tenho 26 anos, tomo remédio 💊, e fico bem menos bad. Você já pensou em ir em um psiquiatra? Hoje em dia é as vezes, porque eu me sentia assim todos os dias antes de começar a tomar remédio","",""
"909861761446981642","Novembrode1996#7749","4/19/2023 10:30 PM","E a gente nunca é bom de mais, a gente é sensível, carinhoso, se importa, quer dar nosso melhor, tenta dar nosso melhor, se doa, cuida, precisa ser cuidado também. E isso já é muito em uma sociedade tão individualista, fria. Mas nós também temos potenciais bem ruins","",""
"801186251117953035","skwfor","4/20/2023 9:14 AM","Talvez seja o desejo de ser cuidado e amado, carência talvez?","",""
"801186251117953035","skwfor","4/20/2023 9:15 AM","Daqui um tempo eu vou ir a um psiquiatra mas acretido que até lá eu melhore um pouco sobre tudo o que sinto, talvez seja questão de tempo.","",""
"909861761446981642","Novembrode1996#7749","4/20/2023 11:11 AM","Eu tenho muita carência, a gente nunca quer aceitar que a gente tem. É isso não é bom, carência deixa a gente vulnerável, a gente acaba namorando e ficando com pessoas tóxicas.","",""
"909861761446981642","Novembrode1996#7749","4/20/2023 11:15 AM","Eu tenho um pai com um grau de autismo leve, e eles não entendem sentimentos, tipo eles não conseguem legitimar o sofrimento no outro, se colocar no lugar do outro muitas vezes, eles não gostam de abraço, eles não tem conversa sobre as emoções, eles não discutem a relação. O jeito que meu pai tem de demonstrar que ama, é comprando coisas pra mim, mas ele mal fala comigo, e ele nem percebe isso. Quando eu era criança e adolescente eu achava que ele não me amava, uma pessoa que mora comigo, gosta de ficar sozinho, não quer conversar… pra uma criança isso é muito difícil. E essa ausência de diagnóstico fez com que eu nunca tenha conseguido entendê-lo, eu só entendo ele agora que tenho 26 anos. Mas por esse vazio de querer uma atenção do meu pai que ele não podia dar me fez uma pessoa carente, e eu me meti em vários relacionamentos abusivos, que a pessoa não me merecia.","",""
"909861761446981642","Novembrode1996#7749","4/20/2023 11:16 AM","Tem partes do nosso sofrimento que são químicas mesmo, tipo depressão, vazio sem motivo. Mas partes que são psicológicas, que com psicólogo conseguimos resolver. Normalmente é os dois","",""
"801186251117953035","skwfor","4/20/2023 12:39 PM","É, eu também não tive meu pai muito presente, ele só compra as coisas para mim e me dá dinheiro, mas eu não reclamo disso até que gosto não sei, só me acostumei com isso","",""
"801186251117953035","skwfor","4/20/2023 12:42 PM","Esse é o problema, não quero ficar carente até o próximo relacionamento, quero curar isso e me fazer uma pessoa mais forte já que isso pode me meter em relacionamentos tóxicos como você disse, o meu primeiro relacionamento acabou por que a pessoa percebeu que ela estava ""abusando"" de mim e isso não era bom pra ela e nem pra mim.","","🌺 (1)"
"909861761446981642","Novembrode1996#7749","4/22/2023 1:52 AM","Minha psicóloga, quando eu tinha surtos de depressão, de solidão, sensação de abandonada, carência desse jeito, ela chamava isso de surto de desamparo. E dizia que quando eu sentir isso eu devia me amparar…","",""
"909861761446981642","Novembrode1996#7749","4/22/2023 1:52 AM","Vou explicar","",""
"909861761446981642","Novembrode1996#7749","4/22/2023 1:55 AM","Ela disse que quanto a criança é muito pequena, ela precisa da mãe pra sobreviver, então ao ficar sozinha, ou ter o perigo de ser abandonada, desamparada a criança instintivamente sente que vai morrer, porque de fato se for abandonada ela vai morrer, então ela grita e chora para que quem cuida dela chegue logo, ou qualquer um outro faça. Quando sofremos traumas de desamparo, na infância, como por exemplo um pai ausente. A sua criança em algum momento quis o pai presente, e não teve.","",""
"909861761446981642","Novembrode1996#7749","4/22/2023 1:55 AM","Por exemplo","",""
"909861761446981642","Novembrode1996#7749","4/22/2023 1:56 AM","No meu caso, meu pai é autista, ele odeia abraço, odeia ser tocado, não conversa muito, o único jeito que meu pai sabe demonstrar que ama é comprando coisas… hoje eu entendi isso, mas quando eu era criança, eu achava que meu pai não gostava de mim. E me sentia abandonada, sentia que ele não gostava de mim…","",""
"909861761446981642","Novembrode1996#7749","4/22/2023 1:57 AM","Eu queria me sentir amada e também não tive","",""
"909861761446981642","Novembrode1996#7749","4/22/2023 1:58 AM","Quando fui ficando adolescente eu fui percebendo que eu era carente, e a pergunta é, nossa porque? De onde isso vem? A gente inconscientemente fica querendo ocupar esse vazio do trauma de se sentir rejeitado por uma das pessoas que deveriam ser as mais importantes das nossas vidas","","🌺 (1)"
"909861761446981642","Novembrode1996#7749","4/22/2023 2:00 AM","Então ficamos buscando preencher esse vazio, e quando estamos com alguma pessoa amamos intensamente de maneira carente","",""
"909861761446981642","Novembrode1996#7749","4/22/2023 2:00 AM","E quando termina o relacionamento a gente sente como se a gente fosse morrer","",""
"909861761446981642","Novembrode1996#7749","4/22/2023 2:00 AM","Reflexo disso.","",""
"909861761446981642","Novembrode1996#7749","4/22/2023 2:01 AM","A pergunta é Como se amparar?","",""
"1067835661618532352","Trink ✨#2695","4/22/2023 5:59 PM","Ela disse alguma coisa sobre codependencia ou borderline?","",""
"1067835661618532352","Trink ✨#2695","4/22/2023 6:02 PM","Você está mais que certo nisso. Um parceiro não pode curar uma questão psicológica em nós. Quando ter uma relação se torna necessidade, deixa de ser uma escolha natural e racional. Sair e entrar em relacionamentos para não sentir o fardo de uma questão psicológica não resolve e nem  é justo. E não costuma terminar bem. Uma hora o parceiro vai entender que aquilo é problematico, mesmo que não entenda exatamente que se trata de uma questão da mente do outro.","","❤️ (1)"
"909861761446981642","Novembrode1996#7749","4/22/2023 11:28 PM","Não sou borderline, eu fiz terapias e isso passou, eu era assim quando adolescente. Hoje eu tenho 26 anos","","🌺 (1)"
"909861761446981642","Novembrode1996#7749","4/22/2023 11:28 PM","Muitas pessoas com questões de abandono acabam tendo essa dinâmica","",""
"909861761446981642","Novembrode1996#7749","4/22/2023 11:29 PM","Por isso essa pergunta","",""
"1067835661618532352","Trink ✨#2695","4/22/2023 11:32 PM","Já ouviu falar do curso da criança interior ferida da doutora Beth Zamerul? Ela fala exatamente disso. Ela tem um canal no Youtube. A falta de afeto na família, ou uma relação disfuncional cria uma eterna criança ferida que buscará no outro sua completude. E isso tem que ser tratado. É daí que vem a codependencia emocional.","","❤️ (1)"
"1067835661618532352","Trink ✨#2695","4/22/2023 11:32 PM","E como você lidou com isso?","",""
"909861761446981642","Novembrode1996#7749","4/23/2023 10:57 AM","Siiiiim","","🌺 (1)"
"909861761446981642","Novembrode1996#7749","4/23/2023 10:58 AM","Psicóloga, foi assim que eu entendi que era isso… a gente tem que mexer nas nossas férias a fundo pra cura-las","","🌺 (1)"
"909861761446981642","Novembrode1996#7749","4/23/2023 10:58 AM","E também mandei meu pai pra psicóloga","",""
"909861761446981642","Novembrode1996#7749","4/23/2023 10:59 AM","Eu ia embora de casa, minha mãe disse que ia comigo. Ele é bastante saudável com a minha mãe, ele sempre foi disfuncional pra caramba comigo mesmo. Minha mãe falou que ia embora comigo, ele chegou em casa ele ficou bastante triste e disse pra gente não ir embora, que ele ia fazer terapia, e desde então ele melhorou muito muito mesmo","",""
"909861761446981642","Novembrode1996#7749","4/23/2023 10:59 AM","A convivência é outra","",""
"909861761446981642","Novembrode1996#7749","4/23/2023 11:00 AM","Mas é aquilo que falei, ele é autista, entao até eu ter sido uma criança ferida tem muita relação com isso. Se ele tivesse feito terapia desde sempre teria sido melhor. Porque ele acabava sendo muito disfuncional","",""
"1067835661618532352","Trink ✨#2695","4/23/2023 1:14 PM","Legal!!","",""
"1067835661618532352","Trink ✨#2695","4/23/2023 1:19 PM","É exatamente isso. Eu vejo muitas pessoas com questões psicológicas que pensam que os sintomas são a doença e não algum fator mais profundo. Vejo outras que esperam que os terapeutas curem seus sintomas sem que eles se permitam ter essa abertura pra investigar a raiz do fator traumático que desencadeou tais sintomas. Precisa ter coragem e determinação pra isso, mas é necessário. Já soube de casos onde a pessoa desenvolveu problemas psicológicos porque quando era bebê dormiu no colo da mãe e acordou no berço, no escuro. A mente do bebê interpretou aquilo como rejeição por parte dos pais. E a pessoa só descobriu isso porque fez hipnose e regrediu na memória. E então ela percebeu que não era nada daquilo, ressignificou a memória e curou o trauma. Como no seu caso. Você ressignificou a memória ao saber que seu pai era autista e por isso ficava longe afetivamente. Então essa visão geral de que é sempre bom fazer acompanhamento com um terapeuta é algo realmente certo. Às vezes você tem travas que talvez nem pense que venha de um fator na infância.","","❤️ (1)"
"1067835661618532352","Trink ✨#2695","4/23/2023 1:22 PM","Fez muito bom. Fico feliz que ele tenha aceitado.","",""
"1067835661618532352","Trink ✨#2695","4/23/2023 1:23 PM","Pra falar a verdade a maioria das famílias deveriam fazer consultas juntas hoje em dia, muitas coisas viriam à tona, muitas magoas esclarecidas, problemas resolvidos.","","❤️ (1)"
"1067835661618532352","Trink ✨#2695","4/23/2023 1:24 PM","Chegou ao extremo mais funcionou. Que bom que terminou tudo certo!","","❤️ (1)"
"1067835661618532352","Trink ✨#2695","4/23/2023 1:25 PM","Exatamente. Os pais dele já deveriam ter tido esse acompanhamento. Mas é o que eu percebo das novas gerações. Vão empurrando os problemas com a barriga e isso vai respingando em todos que nascem depois. Isso é algo que deveria estar sendo conscientizado na sociedade. Isso é uma causa muito grande.","","❤️ (1)"
