AuthorID,Author,Date,Content,Attachments,Reactions
"993671244333453372","eviskrrt","7/14/2023 9:33 PM","eu tinha saído com meu irmão por meia hora e qnd cheguei em casa minha mãe tava triste e perguntei oq aconteceu, ela me disse q meu pai começou a brigar com ela sem motivos e jogou as coisas dela no chão, a cara dela diz q ela está cansada e triste, não aguento ver isso e estou me sentindo culpada por ter saído, apesar de q eu n conseguiria fazer nada","",""
"993671244333453372","eviskrrt","7/14/2023 9:36 PM","tô me sentindo muito mal por tudo","",""
"1093039353602773003","alex_gamedra","7/14/2023 9:57 PM","Ele já cometeu alguma coisa com ela?","",""
"993671244333453372","eviskrrt","7/14/2023 10:32 PM","fisicamente não","",""
"1093039353602773003","alex_gamedra","7/15/2023 10:36 AM","@eviskrrt não importa se é fisicamente
Sugiro procurar um local para ficarem por um tempo e não falarem a ele
Vai ser um tempo de tempestades então cuidado acima de tudo","",""
"1093039353602773003","alex_gamedra","7/15/2023 10:36 AM","Denunciem ele","",""
"1093039353602773003","alex_gamedra","7/15/2023 10:36 AM","E façam ela tirar ele da vida de vcs","",""
"1093039353602773003","alex_gamedra","7/15/2023 10:36 AM","@eviskrrt ele que paga as contas da casa ou sua mãe?","",""
"1093039353602773003","alex_gamedra","7/15/2023 10:36 AM","Sua mãe trabalha?","",""
"739231266812985490","teyui.","7/15/2023 12:56 PM","ti me sneintidno horrovel eu nao aguenro mais eu quero me jjhar no metro e acaba r com isso nso faz senitdo viver assimemum corpo que nwo e meueu prefiro destruir esse lixo","",""
"993671244333453372","eviskrrt","7/15/2023 1:48 PM","ela não tira","",""
"993671244333453372","eviskrrt","7/15/2023 1:49 PM","sempre fala q vai tirar e n tira","",""
"993671244333453372","eviskrrt","7/15/2023 1:49 PM","não kk, ele comprou nossa casa mas ela quem paga quase tudo","",""
"993671244333453372","eviskrrt","7/15/2023 1:49 PM","e ela q paga minhas coisas de higiene, e as coisas q eu preciso","",""
"1093039353602773003","alex_gamedra","7/15/2023 2:04 PM","Não é ela que vai tirar","",""
"1093039353602773003","alex_gamedra","7/15/2023 2:04 PM","São você!!","",""
"1093039353602773003","alex_gamedra","7/15/2023 2:04 PM","Filhos ou filho","",""
"1093039353602773003","alex_gamedra","7/15/2023 2:04 PM","Se sinta responsável por sua mãe","",""
"1093039353602773003","alex_gamedra","7/15/2023 2:04 PM","Ótimo então ela tem uma renda","",""
"1093039353602773003","alex_gamedra","7/15/2023 2:04 PM","Se precisar de ajuda com isso tem minha DM livre","",""
"1093039353602773003","alex_gamedra","7/15/2023 2:05 PM","Passei por uma experiência parecida mas quanto mais se estendeu mais eu fiquei azedo com isso me afetando","",""
"1093039353602773003","alex_gamedra","7/15/2023 2:05 PM","Oq te faz se sentir assim","",""
"1093039353602773003","alex_gamedra","7/15/2023 2:06 PM","Insistam!! Enfrente ele você mesma mostre que não liga pra autoridade dele 
O ameace e os krlh","",""
"1093039353602773003","alex_gamedra","7/15/2023 2:06 PM","Ele pode ser seu pai biológico","",""
"1093039353602773003","alex_gamedra","7/15/2023 2:06 PM","Mas um acidente biológico não o torna um pai","",""
"1093039353602773003","alex_gamedra","7/15/2023 2:07 PM","E cuspa na cara dele se for preciso","",""
"1093039353602773003","alex_gamedra","7/15/2023 2:07 PM","Jogue na cara dele o que é ser um pai","",""
"1093039353602773003","alex_gamedra","7/15/2023 2:07 PM","Se quiser fazer até uma armadilha posso fingir ser um policial ótimo","",""
"993671244333453372","eviskrrt","7/15/2023 2:11 PM","obrigada, de vdd","",""
"993671244333453372","eviskrrt","7/15/2023 2:11 PM","já falei q se ele encostar um dedo na minha mãe pra agredir ela, eu vou espancar ele e chamo autoridades","",""
"1093039353602773003","alex_gamedra","7/15/2023 2:12 PM","Isso ae tem que ser assim","",""
"1093039353602773003","alex_gamedra","7/15/2023 2:12 PM","Não tenha medo acima de tudo","",""
"1093039353602773003","alex_gamedra","7/15/2023 2:12 PM","Não tenha nem demonstre medo","",""
"1093039353602773003","alex_gamedra","7/15/2023 2:12 PM","Enfrente o máximo","",""
"1093039353602773003","alex_gamedra","7/15/2023 2:12 PM","Desconte sua raiva nele se possível","",""
"1093039353602773003","alex_gamedra","7/15/2023 2:12 PM","Se sinta livre pra pisar","",""
"1093039353602773003","alex_gamedra","7/15/2023 2:13 PM","Ele chegou mandou um bom dia cedo
Manda tomar no ânus","",""
"993671244333453372","eviskrrt","7/15/2023 2:13 PM","kkkkkkk","",""
"993671244333453372","eviskrrt","7/15/2023 2:13 PM","obrigada por isso","",""
"1093039353602773003","alex_gamedra","7/15/2023 2:13 PM","Eu sou assim então nem sei se deveria tá aconselhando a alguém","",""
"1093039353602773003","alex_gamedra","7/15/2023 2:13 PM","Mas tente fazer sua mãe fazer um b.o isso vai ser bom no futuro","",""
"1093039353602773003","alex_gamedra","7/15/2023 2:13 PM","Pq isso demora...","",""
"1093039353602773003","alex_gamedra","7/15/2023 2:14 PM","E se as autoridades vir eles vão perguntar o pq de ela não denunciar","",""
"1093039353602773003","alex_gamedra","7/15/2023 2:14 PM","E blá blá bla","",""
"993671244333453372","eviskrrt","7/15/2023 2:14 PM","duvido mt ela fazer","",""
"1093039353602773003","alex_gamedra","7/15/2023 2:14 PM","Já disse","",""
"993671244333453372","eviskrrt","7/15/2023 2:14 PM","já q ele n agrediu ela fisicamente","",""
"1093039353602773003","alex_gamedra","7/15/2023 2:14 PM","Armadilha se","",""
"1093039353602773003","alex_gamedra","7/15/2023 2:14 PM","Armadilhas","",""
"993671244333453372","eviskrrt","7/15/2023 2:14 PM","mas não respeita ela","",""
"1093039353602773003","alex_gamedra","7/15/2023 2:14 PM","Veja a parte podre dele","",""
"1093039353602773003","alex_gamedra","7/15/2023 2:14 PM","E coloque pra fora","",""
"1093039353602773003","alex_gamedra","7/15/2023 2:14 PM","Dê um jeito","",""
"1093039353602773003","alex_gamedra","7/15/2023 2:14 PM","É como","",""
"1093039353602773003","alex_gamedra","7/15/2023 2:14 PM","Vc fazer ele espirrar a parte ruim dele pra fora","",""
"1093039353602773003","alex_gamedra","7/15/2023 2:14 PM","Armadilha","",""
"1093039353602773003","alex_gamedra","7/15/2023 2:15 PM","Acho que ele precisa ter medo","",""
"1093039353602773003","alex_gamedra","7/15/2023 2:15 PM","Ah sim medo","",""
"1093039353602773003","alex_gamedra","7/15/2023 2:15 PM","Grite","",""
"1093039353602773003","alex_gamedra","7/15/2023 2:15 PM","Ele não respeitar na sua frente vc grite com ele","",""
"1093039353602773003","alex_gamedra","7/15/2023 2:15 PM","Coloque o dedo","",""
"1093039353602773003","alex_gamedra","7/15/2023 2:15 PM","Se ele for pra cima de vc","",""
"1093039353602773003","alex_gamedra","7/15/2023 2:15 PM","ÓTIMO","",""
"1093039353602773003","alex_gamedra","7/15/2023 2:15 PM","Armadilha!!!","",""
"1093039353602773003","alex_gamedra","7/15/2023 2:15 PM","Nada melhor que vc poder bater numa pessoa que não gosta","",""
"1093039353602773003","alex_gamedra","7/15/2023 2:16 PM","Porr de discord","",""
"1093039353602773003","alex_gamedra","7/15/2023 2:17 PM","Perai","",""
"993671244333453372","eviskrrt","7/15/2023 2:17 PM","TA MUITO RUIM ESSA MERDA","",""
"993671244333453372","eviskrrt","7/15/2023 2:17 PM","por causa dos lixos","",""
"1093039353602773003","alex_gamedra","7/15/2023 2:17 PM","","https://cdn.discordapp.com/attachments/1096597436178370620/1129824028023070891/Screenshot_20230715-141702.png?ex=6518581f&is=6517069f&hm=325d5f9639bcdb88ef7615627db26b9620191640b871b9a88156e7dcb9a2a7c3&",""
"1093039353602773003","alex_gamedra","7/15/2023 2:17 PM","Lixos?","",""
"993671244333453372","eviskrrt","7/15/2023 2:17 PM","aqls caras do discord q foram presos","",""
"993671244333453372","eviskrrt","7/15/2023 2:18 PM","qnd vejo ele desrespeitando ela eu meto o louco e grito msm pra ele respeitar ela e tals","",""
"1093039353602773003","alex_gamedra","7/15/2023 2:19 PM","Sim ótimo","",""
"1093039353602773003","alex_gamedra","7/15/2023 2:20 PM","Continue assim ele vai temer você","",""
"1093039353602773003","alex_gamedra","7/15/2023 2:20 PM","E sempre tenha uma carta na manga","",""
"1093039353602773003","alex_gamedra","7/15/2023 2:20 PM","Gravações
Vídeo e áudio","",""
"1093039353602773003","alex_gamedra","7/15/2023 2:20 PM","Juro é ótimo","",""
"1093039353602773003","alex_gamedra","7/15/2023 2:20 PM","Procure sempre algo para incriminar o sujeito esses seres tem um medo de irem preso","",""
"1093039353602773003","alex_gamedra","7/15/2023 2:20 PM","E com provas vc ganha fácil","",""
"993671244333453372","eviskrrt","7/15/2023 2:21 PM","vou começar a fazer isso","",""
"739231266812985490","teyui.","7/15/2023 3:06 PM","disforia","",""
"567510836310966274","gutz5063","7/16/2023 11:21 AM","Gente, eu to sentindo uma dor interna(menta) muito forte e eu nao acho que vou aguentar mais isso","",""
"567510836310966274","gutz5063","7/16/2023 11:22 AM","Minha mente ta so o caco e eu nao tenho forças pra fazer isso passar ou so apenas ignorar","",""
"567510836310966274","gutz5063","7/16/2023 11:25 AM","Eu ignorei por muito tempo muita coisa mentalmente sozinho e sendo honesto, a unica pessoa que me mantem sã é minha namorada e esse fim de semana ela ta ocupada e eu to bem destruído e nao sei mais oq fazer. Nao queria me matar deixando ela e familia de lado mas minha mente ta muito em pedaços. Nao me recuperei tanto de alguns traumas. Ela me faz feliz e muito, so estou tendo um pessimo fim de semana onde to tendo acontecimentos que foi muito pesado para minha pessoa. A real é que eu sinto a falta dela mas essa dor nao cessa. Ela é minha confidente mais fiel e que eu amo muito mas eu to louco com essa dor","",""
"956681140595478538","es_thu","7/16/2023 3:30 PM","Vc ja fez acompanhamento profissional, tipo psicológico? Acho que antes de se quer cogitar esse tipo de coisa vc deveria dar uma chance a esse tipo de tratamento...","",""
"567510836310966274","gutz5063","7/16/2023 4:27 PM","Nao faço","",""
"567510836310966274","gutz5063","7/16/2023 4:29 PM","Eu ja tentei mas é o acumulo de coisas e minha mina acabou de terminar comigo e dps vai me falar o motivo mas importa agr ? Kkkkk eu to crises e tudo mais e dps vem essa, é pedir dms estar bem de saúde? É pedir dms reciprocidade sincera e nao algo falso ?","",""
"801186251117953035","skwfor","7/16/2023 6:00 PM","Bom, se ela terminou com você aconselho a tirar um momento de sofrimento para poder superar isso, afinal passa com o tempo. Não é pedir demais essas coisas que você diz, mas no mundo hoje em dia tem que tomar muito cuidado com quem temos nossos relacionamentos, infelizmente é assim mesmo, mas pessoas boas aparecem com o tempo","",""
"502897771205099520","kyo0636","7/16/2023 9:33 PM","Boa noite","",""
"502897771205099520","kyo0636","7/16/2023 9:35 PM","Queria falar sobre quanto foi uma merda meu dia, tudo piorou quando apareceu a namorada do meu tio","",""
"502897771205099520","kyo0636","7/16/2023 9:36 PM","Acabou vindo atrás dele por causa do término, e estressou demais a minha família, acabei indo pra casa da minha irmã e nisso acabei me metendo num tiroteio pra piorar tudo porquê ela mora num local tipo o RJ","",""
"502897771205099520","kyo0636","7/16/2023 9:37 PM","E pra piora a minha noite minha avó me enchendo de problemas do meu tio e me deixando mais mal","",""
"502897771205099520","kyo0636","7/16/2023 9:39 PM","E eu n consigo parar de chorar desde de manhã, ansiedade vem forte pra krl com esses problemas","",""
"502897771205099520","kyo0636","7/16/2023 9:39 PM","E eles nunca acabam, só se eu fosse embora de casa mas isso tá ruim de eu conseguir dinheiro","",""
"502897771205099520","kyo0636","7/16/2023 9:39 PM","E emprego","",""
"502897771205099520","kyo0636","7/16/2023 9:40 PM","Estou cansada de tantos problemas","",""
"502897771205099520","kyo0636","7/16/2023 9:40 PM","Cansada de tudo ao meu redor","",""
"502897771205099520","kyo0636","7/16/2023 9:40 PM","Não aguento mais esses problemas me atormentando","",""
"502897771205099520","kyo0636","7/16/2023 9:40 PM","E a minha mãe n liga só me joga ainda mas nessas confusões","",""
"912779657705840690","https.kauan","7/17/2023 1:02 AM","@ᵏyoth olha sinceramente você deveria se acalmar oque está acontecendo não é culpa sua.. vc está em um momento ruim apenas dê tempo ao tempo, é sobre em relação ao emprego eu sei que deve ser difícil mais a vida tem dessas tente entregar currículo é espere é o melhor que vc pode fazer é você sabe disso não se cobre tanto.
eu recomendaria vc ir em uma psiquiatra","",""
"502897771205099520","kyo0636","7/17/2023 1:19 AM","Mas n tô aguentando mais esse tempo ruim","",""
"502897771205099520","kyo0636","7/17/2023 1:19 AM","Minha família sempre me dx mal","",""
"502897771205099520","kyo0636","7/17/2023 1:19 AM","Nem dormir eu tô conseguindo","",""
"502897771205099520","kyo0636","7/17/2023 1:19 AM","Mas obg","",""
"935449142765969458","maskedyung","7/17/2023 1:42 AM","o gore tá agindo na sua vida","",""
"935449142765969458","maskedyung","7/17/2023 1:42 AM","n temos escolha a n ser submeter a certos sofrimentos","",""
"1093039353602773003","alex_gamedra","7/17/2023 5:46 AM","Falou certo, ""tempo"" todo momento em nossas vidas podem vir de tempestades, a parte boa de uma tempestade é o céu azul e limpo que vem a seguir, lembre disso sempre que estiver em um momento ruim, e mais uma coisa o universo só é responsável por 50% do trabalho de te dar momentos bons o resto é com você, lute por um ambiente melhor para você, enfrente seus medos, pense em você acima de qualquer pessoa. Lhe desejo sorte nessa caminhada","",""
"993671244333453372","eviskrrt","7/19/2023 6:51 PM","tenho muito medo do futuro, de não passar em nenhum vestibular e não conseguir ser nada na vida apesar de eu me esforçar nos estudos e me cobrar bastante, tenho medo de viver trabalhando só pra ter oq comer e não conseguir aproveitar a vida, passei 4 anos seguidos pensando em suicídio e passei por várias tentativas, até então tinha amenizado se coisas, mas eu admito que ainda tenho pensamentos suicidas pois na minha visão não vale a pena passar por tanta coisa para o final ser o mesmo","",""
"376474706737627137","nesquik061","7/19/2023 8:06 PM","quer conversar?","",""
"993671244333453372","eviskrrt","7/19/2023 8:19 PM","pode ser","",""
"765274761517203467","kally465","7/23/2023 11:48 PM","Eu tenho desabado na minha cama (rede) e ficado olhando o nada como se tivesse entorpecida. Eu penso no passado e me culpo por tudo absolutamente tudo o tempo todo. E fico sem energia e concentração pra começar meu dia e continuar","",""
"765274761517203467","kally465","7/23/2023 11:48 PM","É difícil as vezes respirar","",""
"1023225985233076264","kinho_manz","7/23/2023 11:57 PM","Se quiser conversar","",""
"912779657705840690","https.kauan","7/24/2023 5:22 PM","se quiser conversar sobre isso é só me chamar no PV sou um ótimo ouvinte juro kk é também eu ando me sentindo solitário sabe?","",""
"1076779952663449681","bjork_ramon","7/25/2023 7:26 PM","Preciso de ajuda (Não é pra mim).","",""
"801186251117953035","skwfor","7/25/2023 10:28 PM","Diga lá","",""
"1076779952663449681","bjork_ramon","7/25/2023 10:43 PM","Uma amiga próxima está se sentindo mal. Ela se descreve como fraca, incapaz e inútil. Diz que não vê sentido na vida, e nem vê motivos para viver. Tentei ajudar ela de certa forma, mas tentar não adianta tanto, e eu não sou tão boa pra ajudar dessa forma, então acho que perguntar a alguém o que eu deveria falar talvez fosse melhor.","",""
"542154156929187851","taina578","7/25/2023 11:05 PM","vida muito com muitos compromissos as vezes me enche a mente, sem amigos, no trabalho sozinha, na escola sozinha, em jogos sozinha, as vezes me dão pensamentos negativos","",""
"801186251117953035","skwfor","7/26/2023 12:51 PM","Talvez se ela parar para poder ver de onde vem esses pensamentos, se é fruto de algum trauma e tls fica melhor se tratar, mais caso não seja nada disso, acho que todos passamos por esses momentos, porém cabe a nós mesmos sabermos lidar com isso. Acretido que ela não seja fraca, apenas alguém que ainda não viu a sua vida de outra forma/ângulo ou não descobriu o que realmente gosta, que sonhos quer seguir e etc.","",""
"801186251117953035","skwfor","7/26/2023 12:51 PM","Medo de ficar só?","",""
"828095210121986069","jujiss","7/26/2023 7:06 PM","Entrei recentemente no grupo em busca de um apoio e de alguém pra conversar sobre isso.
Tenho apenas 15 anos e acabei tendo relações sexuais com meu namorado pela primeira vez, mas ele n usou camisinha e disse q iria tirar antes. Sei q isso não é seguro mas mesmo assim permiti.
Hj estou super preocupada e me sentindo super mal, por nao ter certeza se estou gravida ou não, pois ja faz 5 meses q eu n menstruo pq minha menstruação é muito desregulada, ent n tem como saber se minha menstruação atrasou ou não. 
Tive relações sexuais há umas duas semanas atrás, e hj pedi pra ele comprar um teste de farmácia pra mim, mas eu estou surtando pq n tenho com quem conversar sobre isso e tbm n posso contar pra minha mãe, pois ela cometeu o mesmo erro na adolescência, e nunca me perdoaria por isso.","",""
"828095210121986069","jujiss","7/26/2023 7:08 PM","Estou morrendo de medo de fazer o teste amanhã e dar positivo, e mesmo se der negativo é possivel q esteja errado.","",""
"801186251117953035","skwfor","7/26/2023 7:09 PM","Você tem apoio do seu namorado?","",""
"828095210121986069","jujiss","7/26/2023 7:10 PM","tenho","",""
"828095210121986069","jujiss","7/26/2023 7:10 PM","mas n consigo falar sobre essas minhas preocupações com ele","",""
"801186251117953035","skwfor","7/26/2023 7:11 PM","Hm, talvez devesse esperar até amanhã para dar o próximo passo. Não pensar no assunto pode ser uma opção, sei que é inevitável, porém você pode desenvolver SPA e tls.","",""
"801186251117953035","skwfor","7/26/2023 7:12 PM","Acha que sua mãe vai te apoiar? Ou seu pai? Parente?","",""
"828095210121986069","jujiss","7/26/2023 7:13 PM","Minha mãe provavelmente me apoiaria, mas ficaria extremamente decepcionada cmg","",""
"828095210121986069","jujiss","7/26/2023 7:13 PM","Minha fml tbm ficaria mt decepcionada","",""
"828095210121986069","jujiss","7/26/2023 7:13 PM","E meu pai brigaria horrores cmg","",""
"801186251117953035","skwfor","7/26/2023 7:14 PM","Normal, porém acretido que erros são normais de todas as pessoas, eu sempre cometo erros. Seja o que for, seu namorada tem que ficar ao seu lado, não importa as circunstâncias.","",""
"801186251117953035","skwfor","7/26/2023 7:15 PM","Mas, se eles te apoiarem, isso já é algo bem positivo já que muitas famílias não fazem isso e só pioram a situação. Não se preocupe adiantada com isso, espere até ver o que vai dar.","",""
"828095210121986069","jujiss","7/26/2023 7:16 PM","Ok, muito obgg","",""
"828095210121986069","jujiss","7/26/2023 7:16 PM","Vou tentar acalmar meus pensamentos","",""
"828095210121986069","jujiss","7/26/2023 7:16 PM","E ver oq vai acontecer amanhã","",""
"801186251117953035","skwfor","7/26/2023 7:17 PM","Talvez, caso dê negativo e não aconteça nada, isso seja uma lição para que tomem mais cuidado na próxima vez.","",""
"828095210121986069","jujiss","7/26/2023 7:17 PM","Sim, com certeza","",""
"495641865186574357","nanazis","7/26/2023 7:43 PM","Entrei no grupo num ato de desespero e de última opção. Eu amo um garoto faz 5 anos, o qual é meu ex, nós dávamos muito bem mas por conta da imaturidade do meu lado na altura acabámos por nos separar, mesmo assim continuamos amigos eu continuei minha vida mesmo o amando, me relacionei com outras pessoas etc. Ultimamente meu amor por ele anda crescendo, mas tem uma coisa que não contei a ngm, meu outro ex, um homem tóxico está me forçando numa relação com ele, meu grupo de amigos está sempre a dizer que somos fofos e talz mas eu não me sinto confortável com o garoto, ele me toca inapropriadamente e perto dele eu não tenho voz, sou retida… me sinto forcada a estar com ele tanto do meu grupo de amigos tanto da parte dele que, infelizmente, tem uma foto minha +18 da qual ele pode publicar quando lhe bem apetecer. Eu tenho 16 e ele 21, me sinto forcada mas não posso fazer nada, não tenho a quem contar pois quando tentei dizer isso ao hospital eles quase me internaram e contaram aos meus pais de **tudo**, o qual eu não sabia. O garoto já me tocou indecentemente e sinto-me presa na relação e sei que se eu o deixar ele irá publicar aquilo, inclusive ele tem a minha morada e ameaçou vir amanhã aqui ter comigo e os meus pais, e vou ceder ao suicido se isto continuar. Eu amo o outro garoto mas hj falei com ele oq tínhamos q fzr pra voltar… e ele respondeu com a ( print abaixo) não tenho ngm e realmente me sinto a ceder ao suicido e à overdose de comprimidos. Não consigo desabafar desta situação com ele pois sei que nada mudaria. Tenho marcas de ferimentos desse meu relacionamento atual forçado . Eu só queria estar com o outro garoto…. Eu realmente o amo e não quero esquecer","https://cdn.discordapp.com/attachments/1096597436178370620/1133892382979538994/IMG_4699.png?ex=6518a492&is=65175312&hm=73b03eb8db434fcb9e4a36371c080fb2f651e71ff2b584057256121965b4d615&",""
"531216613471551539","romiran#3945","7/26/2023 8:00 PM","@Nana  acho q uma maneira de sair de uma situação arriscada e fazendo algo ainda mais arriscado vc sabe oq e certo pra você talvez não saiba oq tem q fazer agora mais uma hora você vai pensar em um plano para tomar um rumo na sua vida foi mal por este texto e q talvez ate não tenha sentido mais eu so queria falar q se você tiver quer arriscar pra sair dessa situação arisque, boa sorte sinto muito se não ajudei","",""
"495641865186574357","nanazis","7/26/2023 8:01 PM","Eu sei q o garoto vem atrás de mim e me bate até me matar se eu acabar a “”relação “”","",""
"531216613471551539","romiran#3945","7/26/2023 8:02 PM","Denuncie ele isso e errado pra caramba moça","",""
"531216613471551539","romiran#3945","7/26/2023 8:02 PM","Ou ameaçe falando q vai denunciar","",""
"495641865186574357","nanazis","7/26/2023 8:04 PM","Minha cidade não considera isso crime","",""
"531216613471551539","romiran#3945","7/26/2023 8:04 PM","E uma situação bem delicada","",""
"531216613471551539","romiran#3945","7/26/2023 8:05 PM","Ja q ele tem foto sua +18 vc poderia tentar fz o mesmo","",""
"531216613471551539","romiran#3945","7/26/2023 8:07 PM","Mais se vc realmente n quer isso tem q pensar em uma solução pra esse problema","",""
"495641865186574357","nanazis","7/26/2023 8:09 PM","Blockeei o garoto que eu amo…","",""
"495641865186574357","nanazis","7/26/2023 8:09 PM","Ele viu meu desabafo mas como está tarde aq ele disse q estava tarde e queria dormir","",""
"495641865186574357","nanazis","7/26/2023 8:10 PM","E discutimos pq ele disse q eu foracava ele a ficar acordado a responder as minhas msg","",""
"531216613471551539","romiran#3945","7/26/2023 8:10 PM","Intendo","",""
"531216613471551539","romiran#3945","7/26/2023 8:11 PM","N faz cagada tomara q consiga sair dessa situação complicada e tenha uma vida normal e feliz","",""
"495641865186574357","nanazis","7/26/2023 8:12 PM","O “abusador”","",""
"495641865186574357","nanazis","7/26/2023 8:12 PM","Vai para Bélgica dia 5 de agosto","",""
"495641865186574357","nanazis","7/26/2023 8:12 PM","Ele quer fugir cmg","",""
"495641865186574357","nanazis","7/26/2023 8:12 PM","Se ele tentar eu irei me suicidar para ele não conseguir","",""
"531216613471551539","romiran#3945","7/26/2023 8:14 PM","N faz isso moça tenta ir pra algum lugar seguro fica la","",""
"495641865186574357","nanazis","7/26/2023 8:15 PM","Sou de menor, não consigo","",""
"531216613471551539","romiran#3945","7/26/2023 8:16 PM","Fala pro seus pais ent","",""
"531216613471551539","romiran#3945","7/26/2023 8:16 PM","Acho q e a melhor escolha","",""
"495641865186574357","nanazis","7/26/2023 8:17 PM","Não consigo","",""
"495641865186574357","nanazis","7/26/2023 8:18 PM","Eles me chamariam de P-u","",""
"495641865186574357","nanazis","7/26/2023 8:18 PM","E me expulsariam de casa","",""
"456226577798135808","Deleted User","7/27/2023 10:03 PM","Deveria valorizar-se por conta do seu medo perdeu já o seu grande amor","",""
"456226577798135808","Deleted User","7/27/2023 10:04 PM","Se não fizer nada você vai acabar sem liberdade e infeliz @Nana","",""
"456226577798135808","Deleted User","7/27/2023 10:04 PM","Melhor receber bronca do que ser sequestrada e sofrer sabe-se lá o quê","",""
"456226577798135808","Deleted User","7/27/2023 10:05 PM","Em Portugal as leis devem ser rigorosas e com certeza será defendida","",""
"495641865186574357","nanazis","7/28/2023 5:49 AM","As leis aq são horríveis","",""
"495641865186574357","nanazis","7/28/2023 5:49 AM","Máximo de punição é 25 anos","",""
"495641865186574357","nanazis","7/28/2023 5:49 AM","E eles acham-se para crimes","",""
"1061026604047933542","takashi_idk","7/28/2023 9:30 AM","Acha mesmo que isso vai acontecer? Não","",""
"505212989776068618","zeballos13#2656","7/29/2023 2:57 AM","Preciso de ajuda","",""
"1093039353602773003","alex_gamedra","7/29/2023 4:01 AM","@zeballos13 oq precisa?","",""
"1093039353602773003","alex_gamedra","7/29/2023 4:01 AM","Estamos aqui
Para uma conversa
Um desabafo
Sem julgamentos
Apenas ouvir a sua dor 
E se precisar podemos lhe ajudar ou lhe apoiar","",""
"505212989776068618","zeballos13#2656","7/29/2023 4:20 AM","Calma minha internet tá cortando","",""
